tweet_id,tweet_text,year
688636812869369856,solar to hydrogen homes no more lpg be sure to visit backu,2016
1316724254357041152,when hydrogen made from water electrolysis is combined with nitrogen separated from the air we get “green” ammonia kaj portin thinks this is a promising carbonfree fuel that could be used in marine applications in the future,2020
657892234281537536,동영상 space engineers update hydrogen thrusters mp and battery improvements slide,2015
570260992715841537,greet the flying bum aircrafts aerospace hydrogen flyinghigh flyerstalk spaceweather,2015
617365883695038464,bmw reveals hydrogen stealth car can go miles on a tank via,2015
614058149574676482,stanford discovers cheap way to produce hydrogen,2015
601296936063361024,hycopter drone uses hydrogen gas to fly for hours archive newsline battery drones,2015
664622156089679876,that leaked bmw hydrogen concept may not run on hydrogen gets mpg instead report,2015
645170967044616192,germany opens first hydrogen filling station on the autobahn,2015
618744025277952000,hydrogen project gets bin lorry boost fcev,2015
678010119704158209,lbc why are car companys not using hydrogen the pollution will drop by at least,2015
672531634969800704,final step in fueling now starting with loading of liquid hydrogen into centaur,2015
614299200084426752,stanford researchers find a cheaper better way to make hydrogen gas …,2015
659399496061865984,japanese auto makers ramp up battery hydrogen plans,2015
580892459896455168,public hydrogen gas station opens in diamond bar more to open in southern california fcv via,2015
616761168120578048,some of the biggest automakers are taking hydrogen seriously what now via,2015
646225810681040900,hydrogen automotivethe last expedient in passage to soprano leadfree gas costs duybayp,2015
638210136268533760,heres how hydrogen could transform battery life on your portable gadgets mindblowingscience a british,2015
592388560239644672,jeremy need votes for my pitch to rich for funding amap sunderland uni prototype my hydrogen pulse jet rotary engine,2015
558069820680585218,tokyo to get million hydrogen makeover for olympics,2015
660667648821301248,a new hydrogen age is coming thanks to,2015
557563687087525890,tokyo to get million hydrogen makeover for olympics via tokyo olympics,2015
570473214683561984,hydrogen highways are becoming realities in california science tech,2015
643418369568342017,japan’s olympic hydrogen push faces challenges  questions,2015
614728718142062592,stanford researchers find a cheaper better way to make hydrogen gas,2015
677314138293460992,speeding up the hydrogen highway,2015
572392882197405696,over a year ago we fitted our new hr hydrogen cell to daves cherokee running lpg dave reports hes been,2015
1331243696478679040,warrington north mp charlotte nichols calls for support for hydrogen sector in upcoming spending review,2020
1285968141051453442,will the hydrogen revolution start in a garbage dump futurism via,2020
1333504886437244929,hollow nise nanocrystals heterogenized with carbon nanotubes for efficient electrocatalytic methanol upgrading to boost hydrogen co‐production,2020
1255225130072113155,“it is the first time that hydrogen has been used to heat steel in an existing production environmentwe know that hydrogen can be used simply flexibly with no impact on steel quality which would mean a very large reduction in the carbon footprint”,2020
1272793970700058624,s deep purple project develops solutions for offshore production of hydrogen and intermittency management of wind farms by storing the hydrogen subsea and ocean hyway cluster play a part here,2020
1334105282985795588,uk’s national grid to trial gas network with hydrogen  backhand index pointing down  uk’s national grid to trial gas network with hydrogen more at  backhand index pointing down ,2020
1325994221220753408,japan japan eyes replacing oil with hydrogen amid carbon neutral push,2020
1230509969814032384,the delivery of a hydrogen refining plant to loy yang facility in victoria latrobe valley australia has been completed by “this project will deliver australia’s first coal to hydrogen pilot plant,2020
1216763626025095169,„the difference between gasoline and hydrogen engines” megtekintése a youtubeon,2020
1253058379712393217,dont forget about biomass gasification for hydrogen,2020
1284111410532888576,flemish government supports waterstofnet to realize hydrogen ambitions,2020
613016983651618816,fuel cell hydrogen news is out stories via,2015
662262807015104512,fuel cells and hydrogen stakeholder forum on november,2015
615682566419533824,doe hydrogen and fuel cell program annual merit review awards,2015
568111811192430592,graphene membrane allows mobile fuel cells to harvest hydrogen straight from air,2015
580461837902352385,graphenebased fuel cell membrane could extract hydrogen directly from air via,2015
576643914951733248,hydrogen for fuel cell,2015
591587928146489345,alternativefuel pure hydrogen hho generator kit fuel cell browns gas,2015
609020867155103744,alternativefuel pure hydrogen hho generator kit fuel cell browns gas,2015
1222172564988071936,hydrogen and fuel cells gaining ground in germany via,2020
434588433114071042,demand for hydrogen for fuel cells and other emerging markets will climb sharply through,2014
1206602512771485696,support for travel and accommodation of up to £ is available for ukbased companies to attend fuel cell hydrogen joint undertaking fchju call information day,2019
880599290493710336, globe with meridians  looks at hydrogenbased fuel cell technologies and what solutions can you provide,2017
932618846107611137,breakthrough ceramic membrane technology makes hydrogen infrastructure for fuel cell ele,2017
858773058747854848,the advantage to using compressed hydrogen is that the clarity fuel cell can be refuele,2017
1466362044437999628,continuing with our special program dedicated to the european hydrogen week today from cic energigune we present a comparison of two of the fuel cell technologies with the greatest potential pemfc and sofc  play button  and if you want more information backhand index pointing down ,2021
289769961180774400,rt new catalyst produces affordable hydrogen for fuel cell cars,2013
320146499717713920,virginia tech learns how to get hydrogen from any plant might lower fuel cell costs,2013
320091370775801856,virginia tech learns how to get hydrogen from any plant might lower fuel cell costs,2013
1006645638522552323,congressional letter national fuel cell hydrogen reception tonight congress,2018
1532982834956103680,desperate attempts by tesla fanboy to spread a negative image of hydrogen and fuel cell which nobody cares,2022
1331270434856177665,join us on the th december for hydrogen talks organised by at free registration at,2020
1405287315832926208,my assessment of on netzero policy on show £k is boiler you’ll need heater pump hydrogen that’s also its price installation adds £k rishi also used incorrect cliches about costofnetzero coming down eg offshore wind i’m afraid that’s wrong,2021
1361668873188241408,we are proud to join with partners and to build the uk’s first homes with household appliances fuelled entirely by hydrogen hear dr angie needle cadent director of strategy explain how hydrogen can help us reach netzero,2021
1425684540715118593,boris johnson’s net zero dreams suffer blow as ‘blue hydrogen’ could be more polluting than natural gas  thought balloon  fossilfuels carbonneutral,2021
1552646531026767872,hydrogen is “crucial” to reaching net zero says ccc chief chris stark made the comments while on a tour of uk hydrogen innovations hosted by read more,2022
1294614959070932993,hydrogen supercar concept debuts chevy corvette driven roadshow week in review roadshow,2020
1339598956645367809,new federal hydrogen strategy aligns with albertas blue hydrogen plans really the strategy is to take natural gas a perfect fuel an turn it into hydrogen yes the same stuff they used in the hindenburg brilliant,2020
1492742787552342018,reliance industries to produce blue hydrogen at competitive prices report,2022
1278159271260110849,is the hydrogen tech revolution hope or hype,2020
1261319451783372804,uk gears up for hydrogen heating,2020
1382411233907838978,the latest the silvias trips daily thanks to hydrogen sustainability,2021
1279856307403722755,we need a hydrogen strategy not stupid carbon taxes europes leaked hydrogen strategy is very ambitious,2020
560231750924644352,ab toyota promoting mirai as if hydrogen tax credit never went away,2015
591320646040223744,as the hydrogen debate rages toyota admits its mirai fcv is literally ‘fueled by bullsht’ toyota and filmma,2015
604093018761658369,can a car really run on water let’s find out toyotamirai,2015
674272250443509760,the toyotamirai can run on hydrogen made from all kinds of things weve been experimenting fueledbyeverything,2015
629019899298344960,whether hydrogen and toyota will eclipse tesla,2015
552990867531644928,toyota offers automobile hydrogencell patents free of cost the new indian express,2015
628355546815463424,how toyota is making sure hydrogen will be ready for mirai,2015
552481096063922176,bbc news ces toyota opens up hydrogen patents,2015
1315679887819243520,toyota mirai doll mobile means his holiness now uses hydrogen,2020
330443507166748672,video toyotas production fuel cell car to cost between k wvideo while the cost of building a hydrogen…,2013
400245484972814336,toyota unveils fuel cell car now all we need are enough fueling stations with pure hydrogen,2013
529538342195453952,toyota fcv rallies to the hydrogen cause as zero car its been two decades since toyota…,2014
533062018597527552,toyota could lose on every hydrogen fcv it sells,2014
502822786436329473,toyota could be wrong about the high cost of hydrogen via,2014
504659225256415232,gasoline is so th century learn how toyota plans to set the next years in motion using hydrogen,2014
547348914551021568,th us congress leaves k hydrogen credit on the table for the few who will be purchasing a toyota mirai i,2014
534699822331494400,toyota bets on hydrogen technology financial times,2014
534754039565533184,it’s official the new toyota fcv is called mirai toyota toyotamirai mirai hydrogen,2014
1188456569052241920,toyotas new mirai could run on a single cows poop for a year,2019
930117245249970178,chairman of toyota introduces the hydrogen event at cop hydrogencouncil,2017
854748414717812737,toyota’s still serious about hydrogen—it built a semi to prove it tech technews technology,2017
373977055647371265,toyota planning reveal of hydrogen concept car at consumer electronics show in ces,2013
337229440440496128,toyota mercedes join doe hydrogen partnership,2013
390648408509538304,will this toyota do for hydrogen what the prius did for hybrids,2013
987063201014558720,shell and toyota move forward with hydrogen facility for freight at port of long beach,2018
1016287648720347136,toyota backing hydrogen boat world tour,2018
623337706345603072,nanowires help produce hydrogen fuel using sunlight,2015
641595809918795776,so whats it like running the first domestic hydrogen fuel station,2015
631142371414052864,nist reducing the high costs of hydrogen fuel pipelines,2015
651184034844774400,recharge wrapup public hydrogen fueling in belgium new proterra bus autoblog blog a belgium belgique,2015
679422838500143104,virus particles engineered to hold enzymes that generate carbonfree hydrogen fuel,2015
585493066972274688,scientists make cheap hydrogen fuel from corn husk waste,2015
585897130209992704,scientists use corn husks to produce cheaper hydrogen fuel,2015
572700143440556032,germany is leading the way in hydrogen fuel infrastructure,2015
590471360213815296,toshiba may have found a way around the dirty side of hydrogen fuel,2015
573519043375816704,chrissy sells apd air products presents paper displays hydrogen fueling,2015
1220457129842180096,interesting update on hydrogen fuel technologies,2020
1257878473353412609,artificial leaf device turns water and sunlight into hydrogen fuel,2020
673006046844096512,how establish a hydrogen fuel cell to run your car on water,2015
667666023106105344,hydrogen fuel cell – its benefits and challenges,2015
679997167092641792,these hydrogen fuel cells can keep a drone in air for up to two hours via h hydrogen fcv,2015
679020862931148805,they make rackmountable hydrogen fuel cells that can work on my rooted phone,2015
635645480077144064,uk tech firm integrates hydrogen fuel cell inside iphone for weeklong charge a uk tech company has developed a…,2015
635915131654791168,iladies british firm builds experimental iphone with hydrogen fuel cell applenews,2015
676845312934285312,hydrogen fuel cells give drones several hours of flight time,2015
594540417128992768,hydrogen fuel cells find a niche despite doubts ldnont see cbc article staysafedrivewise,2015
669945593058357249,gm us army extreme testing hydrogen fuel cell colorado,2015
639473886703304704,uk tech firm integrates hydrogen fuel cell inside iphone for weeklong charge hyfri,2015
676836487623741440,theverge hydrogen fuel cells promise to keep drones flying for hours,2015
673157059089555456,how establish a hydrogen fuel cell to run your car on water,2015
568321566469177344,elon musk hydrogen fuel cells are extremely silly are they really see more,2015
616533115364843520,bmw finally unveils its hydrogen fuel cell i concept the bmw i already looks like a car …,2015
552231119072923650,rt dr mikio kaku says the hydrogen fuel cell mirai will be environmental game changer ces,2015
676837021906677760,hydrogen fuel cells promise to keep drones flying for hours,2015
609010712732553217,bmw to return to le mans with radical hydrogen fuel cell racer motor authority,2015
571037294167109632,nanoflowcell quantino water fuel cell car stuff so is the nanoflowcell quantino a hydrogen fuel cell car or,2015
609383662270967808,bmw to return to le mans with radical hydrogen fuel cell racer,2015
636082827554103296,apple daily tim cook saves apple stock possibly us stock market iphones with hydrogen fuel cells,2015
580033332932554752,since when does austin have hydrogen fuel cell buses,2015
635912773130657792,british firm builds experimental iphone with hydrogen fuel cell source appleinsider,2015
1315427689566593024,as envisioned by great visionary dr jee  backhand index pointing down  backhand index pointing down  backhand index pointing down  backhand index pointing down  trial run of indias first hydrogen fuel cell car successfully conducted by csir and kpit  bouquet  bouquet ,2020
1325868247074344964,dronelife gt hydrogen fuel cells for passenger drones honeywell purchases ballard unmanned systems assets droneactor drones dronebusiness,2020
1339962833619005445,coming to canadian pacific rails an hfc hydrogen fuel cell linehaul locomotive,2020
1304051098601369606,grants award of eur million to norwegian university on hydrogen fuel cell research,2020
1314980447491821568,csir kpit conduct successful trial runs of hydrogen fuel cell prototype car – et auto,2020
428683409909907456,sprint will deploy hydrogen fuel cell kansas city business journal,2014
539458911250964480,hydrogen fuel cell technology has reached mass market this is awesome,2014
539058520562212866,virtual events can fuel cells find a home in the data center hydrogen fuel cells are inching closer to brin,2014
550006036422471680,mt hydrogen fuel cells will become a fuel of the present in,2014
526774851382837248,volkswagen looks set to unveil hydrogen fuel cell car in november altfuel ca h vw,2014
438829273554509825,walmart triples hydrogen fuel cell order via,2014
429262968153722882,rt are going to be using hydrogen fuel cells to help with deliveries hydrogen,2014
485776466584424450,make your own hydrogen fuel cell minute video all datasheets,2014
429909265059282944,make your own hydrogen fuel cell minute video all datasheets,2014
442080595481354240,make inexpensive hydrogen fuel cells a reality researchers discover how soils control atmospheric hydrogen,2014
431286321848406016,hero motocrop ion hydrogen fuel cell concept bike autoexpo,2014
1209024711700541440,on the streets of london will be lowfloor buses gold hydrogen fuel cells from the portuguese company caetanobus according to engineers the supply of hydrogen will be enough to run up to km siemens hydrogen,2019
1110713210099793920,starting our tour of the microgrid in their hydrogen fuel cell bus,2019
1181645359057195019,brush up on your hydrogen fuel cell knowledge in celebration of hydrogen and fuel cell day today here are fun facts about hydrogen fuel cell technologies plus resources to help you learn more,2019
839903611727581185,hydrogen fuel cells get a boost from teslas elon musk,2017
855489158659190784,will provide sunline five new hydrogen fuel cell buses hydrogen earthday transit,2017
868464025666895873,hydrogen fuel cell pilot project plug,2017
830094293159333888,japan is at odds with elon musk over hydrogen fuel cells via,2017
820913057425723393,bet youd like a go in this hydrogen fuel cell a htron,2017
1399671249106833415,rosberg x racing has been crowned champions at first ever ocean x prix making it two wins from two the rally championship uses a hydrogen fuel cell generator designed and engineered by hview hydrogenmobility,2021
1375506067216424960,the time has finally come hydrogen fuel cell companies in canada take off after toiling in obscurity for years,2021
1375892946919297033,in zhongtong hydrogen fuel cell buses were put into operation in weifang datong foshan jining liaocheng and wuxi in the bus maker will continue to actively promote the commercialization of its hydrogen fuel cell buses in cities across the globe,2021
1430344442666536964,congrats hypoint and piasecki reach m deal to develop hydrogen fuel cells systems for evtols,2021
1353061253648850947,hydrogen fuel cells surely could be the fuel for the st century especially when just super cargo ships are said to pollute as much as all the automobiles on earth and that hydrogen could be made from natural gas so why would anyone be thinking you know,2021
289180854197030912,learning how to say hydrogen fuel cells in spanish justwhy,2013
353559620113018880,i liked a video how its made hydrogen fuel cells,2013
402762766697525249,scientists create water splitter with nickel nanofilm for using in hydrogen fuel cells stanford researchers,2013
400440114201243648,daily roundup hydrogen fuel cell usb charger tegra note review vine for windows phone and more,2013
385349156090683394,hydrogen fuel cell versus conventional batteries this is fun,2013
320093168387379200,virginia tech learns how to get hydrogen from any plant might lower fuel cell costs hydrogen fuel cell car,2013
320093352345350144,virginia tech learns how to get hydrogen from any plant might lower fuel cell costs hydrogen fuel cell car,2013
327731184836694016,hydrogen fuel cell uav diy drones a hydrogen fuel cell is a device that converts hydrogen gas air into el,2013
1061958855050125313,construction begins for world’s first hydrogen fuel cell ferry,2018
1045513583017086976,six hydrogen fuel cell buses started running route no in jiading district yesterday the first fuel cell buses in the city,2018
956836991852793856,midlands businesses interested in hydrogen fuel cells join een brokerage event ccshfc register,2018
994922434125008896,th grade students learning about hydrogen fuel cell carstechnology frostscience,2018
958637579670351874,in the first hydrogen fuel cell bus  bus  went into regular service in the gelderland region  Netherlands  it only emits water  droplet  which improves air quality its also almost completely silent hymove developed the technology for the bus w investeu support,2018
1478011752193347588,hydrogen fuel cell stocks to keep a tab on via,2022
1582087550776115200,first hydrogen gets goahead to trial its hydrogen fuel cell vans on uk roads trader shippingnews freightnews,2022
1514249683874598912,hydrogen fuel cells are finally attracting vc interest,2022
809609963479924738,tfw she energizes your hydrogen fuel cell,2016
694549058594025473,easyjet unveils plan for hybrid planes easyjet announced plans to trial the use of hydrogen fuel cells on the,2016
726507967130947584,checking out hydrogen fuel cell uav on diy drones,2016
694549513126547456,easyjet unveils plan for hybrid planes easyjet announced plans to trial the use of hydrogen fuel cells on the,2016
689919844779757568,johnny heath corpus christi affordable hydrogen fuel cells news switchable material could enable new memory chips,2016
700488997793976320,sagelinq technology easyjets plans for a hybrid fleet using hydrogen fuel cells,2016
735591877420818432,tesla cofounder says hydrogen fuel cells are a scam via,2016
736849192568528896,tesla cofounder says hydrogen fuel cells are a ‘scam’,2016
747611396720951296,jun reviewga review make your own hydrogen fuel cell minute video all datasheets review save…,2016
764193097408479232,bmw series gt hydrogen fuel cell prototype spotted during testing,2016
1295657955958947840,became the first european airport to receive certification as carbon neutral in and has maintained this status ever since now they have taken this further as they begin to develop hydrogen fuel capabilities  airplane departure  fuel pump ,2020
622125669846249472,toyota unveils fcv hydrogen fuel enclosed space sedan gdy,2015
552277952399179776,toyota opens up hydrogen patents almost patents relating to hydrogen fuel cells owned by toyota are bei,2015
552259812898390016,toyota to offer access to hydrogen fuel cell patents royalty free to speed adoption of hfc cars,2015
654608750523875328,toyota reunites doc brown and marty mcfly to promote mirai hydrogen fuel cell car adweek,2015
573500874196017152,is there another reason for toyota to make a hydrogen fuel cell car toyota is making a hydrogen fuel cell ve,2015
553976380665626624,weekly recap toyota propels hydrogen fuel cells,2015
591346781927018497,toyotanews toyota mirai takes to the track the toyota mirai will be the first hydrogen fuel cell vehi,2015
654415597145563136,toyota reunites doc brown and marty mcfly to promote its new hydrogen fuel cell car,2015
537323412297752576,toyota on hydrogen fuel cell technology “simply a better battery”,2014
423219279488892928,rt toyota made big news at ces with their hydrogen fuel cell car,2014
534363852851257344,toyotas hydrogen fuel cell car is coming to america in,2014
481819061966209024,toyota takes on tesla with its first hydrogen fuel cell car,2014
534355074508914688,toyotas hydrogen fuel cell car is coming to america in,2014
534354920732758016,toyotas hydrogen fuel cell car is coming to america in,2014
534359366854782976,toyotas hydrogen fuel cell car is coming to america in,2014
499571803019165697,auto toyota hydrogen fuel cell prototype drive on the pacific coast highway to the tho autos car cars,2014
534375777312452608,socialmedia toyotas hydrogen fuel cell car is coming to america in,2014
1182433355901652993,the toyota mirai hydrogen fuel cell car has more luxury less ugly,2019
926079525041201154,top gear toyota “hydrogen fuel cells are the ultimate eco car” via,2017
855128209079193600,toyota starts project portal the first hydrogen fuel cell tractor trailer,2017
1410993676650749963,very naughty of your driver in a hydrogen fuel cell car driving on the am towards bracknell from junction at holding a phone in his hand and swerving in his lane with toyota hydrogen all over it  face with rolling eyes  tut tut,2021
294267929153896448,toyota and bmw are readying to enter into an agreement to share hydrogen fuel cell technology in july toy,2013
421763905434566657,toyota focuses on hydrogen fuel infrastructure in california,2014
496671917613387776,air products expands hydrogen tube trailer fleet in uk upgrades hydrogen fueling station at heathrow air pro,2014
461989450491240448,california startup scores m grant for hydrogen fuel filling stations,2014
515215472900722688,harvesting hydrogen fuel from the sun using earthabundant materials,2014
437568010052595713,new inexpensive production materials boost promise of hydrogen fuel,2014
1200506049108701184,heliogen achieves breakthrough temperatures from concentrated sunlight for industrial processes with momentum toward commercial hydrogen fuel creation,2019
1109791259684675584,hydrogen fuel fans just had a major breakthrough,2019
1175765634954645504,new technique turns seawater into hydrogen fuel,2019
1200006526775242752,new study looks to biological enzymes as source of hydrogen fuel gt,2019
881183998201954311,hydrogen fuel reaches liftoff,2017
905164950246629376,this new recipe for cheap hydrogen fuel uses light and a few simple ingredients,2017
926126869723803648,increasing the potential of hydrogen fuel,2017
868596158716837889,how hydrogen fuel is made via,2017
872870703980314625,hydrogen fuel finds a home in hawaii grnbz via,2017
857603234676043776,linde to supply hydrogen fuel technology at shell ecomarathon,2017
836191171282075648,hydrogen fuelling to be a focal point of petroforum us hydrogen petroforumus,2017
872014301976023041,researchers create hydrogen fuel with artificial photosynthesis more tech stuff tech…,2017
1448837988197097474,hydrogen fuel firm ecombustible eyes up to b spac deal with bene,2021
1350774876492107778,numbertwo ocean carrier joins partnership on hydrogen fuel r d,2021
1427075069583429636,no hot air govt’s mission to make hydrogen fuel is costly but doable,2021
353388233461219328,news new catalyst could cut cost of making hydrogen fuel madison wi spx jul a,2013
293853280424050688,artificial photosynthesis project aims to create hydrogen fuel wired,2013
339077448295657472,japan takes charge of building hydrogen fuel infrastructure,2013
390140966201348097,new device harnesses sun and sewage to produce hydrogen fuel,2013
