tweet_id,tweet_text,year
1419458994209394690,having led a campaign in early ‘s to promote hybrids—toyota lent us prius’—by putting celebrities in the fuel efficient cars to the oscars i can say they undeservedly got lots of green cred as they then fought calif every step of the way and still do,2021
616246809862627328,honda nissan and toyota commit to greener future for cars tokyo ap — toyota nissan and honda are working,2015
1007000401818812417,hcars could become a common sight on the roads of the future in the english town of swindon efforts are being made to turn it into a base and test bed for hydrogen as a transport fuel greenfuture morefuelcells,2018
1167368299337809920,why hydrogen cars could be the green car of choice by via abcclimatewatch,2019
549221792649191424,inhabitats week in green solar farms hydrogen cars and dprinting in space,2014
1501245939964645378,james may could hydrogen cars be a better green alternative than electric via,2022
306345437944762368,hyundai will begin mass production of hydrogen fuel cell cars this week via,2013
839590565041717248,hydrogen inventor since cars the benefits ysq,2017
298658062007402496,hhogamesdotcom sells kits to save you upto of your cars fuel costs and soon hydrogen from air hho,2013
326128232829169667,categories bmw cool bmw hr hydrogen racecar cool cars close original cool bmw hr…,2013
730843270595502080,evening standard filling station produces its own hydrogen for cars that make no pollution evening standard a…,2016
682162864883404800,lexus nextgen ls will boast a more emotional design and a hydrogen drivetrain,2015
668862602131300352,check out the maritime fuel cell project hydrogen safety training video,2015
712586817380491264,automotive training video education hydrogen fueling injection mechanics,2016
779953078824951808,first passenger train of future on hydrogen,2016
780433412985192448,futuristic trains technologies fyi,2016
846123040479985664,canada can help as well hydrogen transport resulted in orders to equip trains and buses k and l post,2017
1446557580730388480,kawasaki motors ltd has ambitious goals announcing plans for motorcycles with electric hybrid and even hydrogen drivetrains in the next four years,2021
1285961388003930112,takingactions ⃣  light rail  for trains  bus  buses  passenger ship  boats  airplane  and maybe tomorrow for planes  right arrow  hydrogen is a key solution for the low carbon transition in mobility backhand index pointing down ,2020
1081928446132006913,sunday train hydrogen may have a future on the rails at the heart of the hydrogen economy is use of renewables solar wind and hydro to split water into o and hydrogen that “green hydrogen” can,2019
1530594866291408898,hydrogen cars wouldn’t be such a bad idea if they were plugin hybrid they already have the electric drivetrain and even a sizable lithium battery over kwh just give them another kwh and a plug and they would all of a sudden not suck so bad for ordinary consumers,2022
1315202181184794625,just laughed out loud at slow and deliberate questioning of the words “space envelope” in a feature about hydrogen trains,2020
1274343491364106241,its a year ago today since the uks first hydrogen train which was unveiled in warwickshire and developed by the university of birmingham and poterbrook the long term aim is to eliminate diesel trains from the network,2020
1056822717490417664,travel news are hydrogen trains the future of uk travel news worldnews,2018
1056786728134922240,are hydrogen trains the future of uk travel,2018
1000015152807403521,the hydrogen train of the future is a lot like the train of today,2018
1553974257155248129,caf begins dynamic track tests on hydrogen train prototype europe germany rail transport,2022
778602233541890048,explains why the world’s first hydrogen train is about to transform transport hydrogen,2016
1142062521152659456,the uk’s first hydrogen train has been given the green light to be tested on the mainline railway  railway car  find the full story here  backhand index pointing right ,2019
1448767397939269635,omg stop relying on fossil fuels just build electrolysis creation facilities hydrogen trains hydrogen cars hydrogen gas stoves hydrogen boilers the tech has been there since farraday but always needed pure water now stamford uni has a coating so it doesnt,2021
928987735033024512,a big thankyou to for taking me for a spin in its hydrogen train whod have thunk it,2017
876836381695365120,canada considering hydrogen train fleets,2017
1042029245437042688,the worlds first hydrogen train is now in service,2018
1054842661587292160,fracking jaguar hydrogen trains tesla vw fully charged news via,2018
1205294265724788736,the cdo for nkt will distribute m units of hydrogen batteries from gidali to jambu,2019
950640091512410112,aviation french region supports safran’s hydrogen fuelcell effort,2018
1284816918159876096,lowcost solartohydrogen cell achieves breakthrough efficiency auspol renewables aviation climatecrisis climateaction hydrogen fridaysforfuture,2020
1507023181449773063,ryanair has published plans for reaching carbon neutrality by midcentury with electric and hydrogen planes and plans to cap growth notably absent from its strategy aviation aviationdaily climatecrisis,2022
1524038199848415233,looking forward to seeing these two shell hydrogen mobile refuelers providing compressed hydrogen gas to zeroavia aircraft at hollister airport california this marks a tangible step forward for the aviation use case for hydroge…,2022
1561864548331802624,the latest the aerospace technology daily thanks to aviation hydrogen,2022
923933587715575809,worlds first hydrogen tram runs in china nation china daily,2017
1222193911965343745,bmw hydrogen vp says fcevs could be as cheap as ice by,2020
1606610220691636224,toyota parodies laughter at the company’s lackluster embrace of evs,2022
470433212842266625,toyota moving away from evs in favor of hydrogen fuel cells fuelcell,2014
1503623399066648576,modelbased design supports engineers and scientists in ensuring key system performance how does the hydrogen supply chain benefit from it join this upcoming webinar series to discover more fuelcell fcevs hydrogeneconomy hydrogenfuelcell,2022
1596302891245268992,as does overhyping evs we will not move forward in a future with one single point of failure and or control hydrogen is a must to give us choices options,2022
505015409633136640,why are evs beating hydrogen fcvs in todays commercial market find out over at pev,2014
1176940435937353729,behind new billionaire trevor milton’s billion push to make america run on hydrogen via evs,2019
1260892049806589952,the auto industry is still barreling towards an electric future writes on — and so are we evs fermatavx,2020
980387263279452160,shell says to support the parisagreement just outlined a radical scenario for what it would take to halt climatechange renewables evs hydrogen ccs greeneconomy,2018
299200315138396160,dc auto show hybrids evs driving wider acceptance of diesel cng and hydrogen,2013
746708356425990144,awesome news hawaii on the path to hydrogenbaby,2016
914459339737485312,irish govt says no to toyota mirai fcev hydrogen as currently not economically viable will look again in,2017
722817825887260672,and other leaders embarking on mile drive with zev hydrogen fuel cell fleet marysvalleyrally,2016
723082257397768192,honda clarity series brings ev phev to hydrogen fuel cell model,2016
538351316024578048,audi a plugin blends hydrogen and batteries to great effect ev la hyfri,2014
854223180743028740,refueling my throwback internalcombustion rental car at sfo heres a hydrogen station for fcev thats what i need to rent next time,2017
1000025258013941760,toyota just doubleddown on a hydrogen fuel cell ev future fuel cells may have not captured the ev market in the same way that hybrid and plugin electric have so far but that isn’t stopping toyota from doublingdown on production as it increases its be…,2018
543899694611828736,bmw readies ev hydrogen updates for detroit auto show green,2014
898309902082293760,hyundai reveals next hydrogen fuelcell suv new ev platform,2017
1447049943248633860,korean media never reported about this moon jae in officially announced we wont be defeated by japan again in defeated with fcev mirai that sets hydrogen miles hyundai asked for help to moon many times,2021
517962622042648576,toyota plans for a fuel cell future will be selling fuel cell cars in uk germany and denmark in fcev hydrogen,2014
1437341367684960257,every ev owner should make copies of this hand it to those saying hydrogen for cars is the future especially in germany where hydrogen efuel nonsense spread by backwardlooking people of the cdu party print it on paper they dont like it digital img btw,2021
855066122185564160,get ready for bnefsummit by catching up on hot topics watch our videos on hydrogen ev charging lng flows,2017
1366572145086779393,gev study shows compressed hydrogen supply to asia is feasible – shipinsight,2021
742944896596770818,mercedes flags km ev platform wireless charging and a hydrogen hybrid via,2016
703189540937277440,worlds first hydrogen aircraft in oban featured in the work,2016
1505651711007854595,hydrogen fuel cell buses and coaches are pretty cool longer ranges faster charges smaller batteries cleaning the air,2022
488685708694290433,technology produces cleanburning hydrogen fuel,2014
506479247146643456,rt rutgers chemists develop technology to produce cheap cleanburning hydrogen fuel,2014
1372571373290336264,doubleduty catalyst generates hydrogen fuel while cleaning up wastewater,2021
1189152763118309376, red question mark are you part of the fuelcells and hydrogen industry  red question mark wanna know more about it join our stakeholder forum in brussels on  spiral calendar  register before its too late  left arrow curving right  sf cleanhydrogen,2019
484405180855627776,posco pkx expects bil in fuel cell sales by iown fcel providing services climate cleantech hydrogen,2014
1209887662515130368,this hydrogen fuel cell electric car cleans the air as it drives,2019
1573354516728238081,on the heels of its newly released draft national cleanhydrogen strategy and roadmap has just opened up applications for bn to establish up to regional hydrogen hubs the agencys plan includes at least one greenhydrogen hub,2022
905431328870588417,drop fossil fuel production and switch to the cleaner more efficient fuel hydrogen st patrick the green r,2017
1344302064357289984,japan’s “green growth strategy” urges utilities to bolster renewables and hydrogen while calling for auto industries to go carbon free by the mids we have the solutions to protect our climate cleanercars,2020
633441435853832192,the clean gren home revolution,2015
1285651265649872901,north vancouver recently got its first hydrogen fuelling station clean economy director wrote a letter in response northvan,2020
1296345254896054272,hosted by mfrazz hyperion comes clean with the xp hydrogen fuel cell hypercar,2020
940261576292163588,method to create clean cheap hydrogen fuel from methane devised,2017
340487320333611009,scientists invent super clean hydrogen fuel technique that could save us all yahoo news via hopeful,2013
340351079072026624,scientists invent super clean hydrogen fuel technique that could save us all yahoo news via,2013
1029761400686698496,new watersplitting technology brings clean hydrogen fuel one step closer,2018
992428498366103552,harvesting clean hydrogen fuel through artificial photosynthesis,2018
938487768648503297,hydrogen fuel cells drive clean quiet buses in cologne and amsterdam fuelcellsworks,2017
927861611007705088,excellent animation stressing the potential important future role of hydrogen as a clean fuel imported or domestic,2017
1575878734531493888,bidenharris administration announces historic billion funding opportunity to jumpstart americas clean hydrogen economy,2022
1313853022770917378,we celebrate ⁦ by continuing working hard to provide clean transportation solutions for the automotive industry been doing this since happy clean air day cleanairdayca cleantransportation cng rng lpg hydrogen,2020
1189097236757647360,keolis new energies tour in  France  starts today  party popper  bus wecommit to present to the publictransport authorities our vision on different clean energies such as bio ngv electric and hydrogen,2019
1446300088784105485,today we celebrate atco is proudly pursuing hydrogen’s potential as a sustainable australian industry and a clean mode of transport but that’s not all learn more about atco’s hydrogen journey at worldhday myh,2021
1556541830694686721,andrew forrest travels the globe trying to persuade leaders of industry and politics — and rankandfile workers — that despite his polluting past he’s the man to champion green hydrogen as the clean fuel of the future,2022
1136538038450892800,if we can get hydrogen fuel from renewable sources great just make sure that transport of it is also clean and green sustainability hydrogen actonclimate,2019
1549463017099653120,ignoring all the science europe is certifying methane gas as green meanwhile the us government is preparing to help companies burn vast amounts of methane in order to make hydrogen which they will market as clean what are we doing here,2022
1190366927325032448,why the coal sector is so excited about australias move to clean hydrogen politics abc news australian broadcasting corporation,2019
1189697296708980736,why the coal sector is so excited about australias move to clean hydrogen abc news all credit to csiro not the government if japan hadn’t made the move the government would have still been saying no continuing defunding csiro,2019
1417385387064971265,making clean hydrogen is hard but researchers just solved a major hurdle physorg,2021
1396709766299361281,good morning the momentum for hydrogen at the highest it has ever been and with the biden administration now throwing further support behind the clean fuel such momentum is only set to grow which plan has the us arcofc,2021
1460867349024841728,this new tech could make hydrogen an affordable clean fuel for planes,2021
1418065783872233473,artdaily recommends making clean hydrogen is hard but researchers just solved a major hurdle hydrogen researchers research newspaper the university of texas at austin read more about this here,2021
1586213177729384448,its official we are speaking at about the only beach clean up in the world turning oceanplastic into hydrogen come say hi to us at the on th nov blue zone,2022
1549418937880018944,clean enwrgy for aircraft,2022
1579511496618672128,our ceo attends today in paris to hyclosing clean h infra fund event organized by  speaking head  shares his view on hydrogen opportunities and potential integration with europes infrastructures in an experts’ roundtable,2022
743897886081974272,researchers find new ways to make clean hydrogen and rechargable zinc batteries,2016
876166580861796354,first cars delivered in major fleet hydrogen car trial cleanair pollution,2017
865377238803521538,ronn motor returns with promise of hydrogen fuelcell extendedrange electric cars via cleantech,2017
586557955232792577,thats awesome dudes hydrogen fuel breakthrough could pave the way for clean cars video,2015
1053315595406622721,hydrogen is key to the uk’s transition to a low carbon economy and unlocking new job and training opportunities producing green hydrogen orkney is harnessing this potential and making the h economy a reality greengb cleangrowth,2018
1042139690781089795,environment cleanair fossilfuel hydrogentrain worlds first hydrogen train rolls out in germany,2018
1359528132743733250,appointed rapporteur for the on the new generation of european partnerships within the horizon europe framework program at stake is a set of nine publicprivate partnerships more info hydrogen cleanaviation circulareconomy railroad,2021
1211010240210190336,why arent u going to invest in hevs hydrogen as the tesla models only have like miles range and the by product from it is only water instead of the co for the electric super chargers is needed for its cleaner and more suitable for long distances,2019
666831423601405952,hydrogen car news ucs welltowheel evs cleaner than pretty much all gas cars there is no mention carkit,2015
728105160417808384,first hydrogen carsharing program starts in germany fcev fuelcell cleanair,2016
1451031618588717056,join us for the inaugural  Canada  Turkey  hydrogen technologies workshop on october hydrogen cleantech canada turkey innovation,2021
1578800894468304897,we know what you’re thinking  thinking face  cleanhydrogen sounds great but when will the tech be ready we work on every step from development all the way to deployment heres just one example of how were bringingsciencesolutionstotheworld  down arrow  hydrogenday,2022
735315505649582080,octa shows off a cleaner and quieter ride the orange county register,2016
913010092429139968,nel asa awarded world’s largest hydrogen electrolyser fueling station,2017
1284765693871665152,reliance to replace auto fuels with electricity hydrogen targets carbonzero co by via,2020
461867024806072321,a fuel cell catalyst that converts hydrogen into electricity must tear open a hydrogen molecule,2014
436985060042874880,new inexpensive production materials boost promise of hydrogen fuel generating electricity is not the only w,2014
684435955428687872,proton movement and electrocatalytic interconversion of electricity and hydrogen fuel,2016
1337297213010087937,with the point plan the th ukcarbonbudget renewable electricity efficiency netzero compliant hydrogen and ccs are the clear champions of a netzero industry  thinking face what actions do we need now in  United Kingdom  find out in our brief  right arrow ,2020
1080779837869043712,fascinating article on china bet on hydrogen fuel cell technology including use of redundant renewable electricity to produce the hydrogen,2019
494855994057322497,interesting question does using excess renewable electricity to create hydrogen make sense,2014
1340762411993849856,in addition the olympic village of the tokyo games it will be utilized in the harumi flag a hydrogen station is set up here and hydrogen is supplied to the town through the wipe line electricity produced by pure hydrogen fuel cells is used in common areas of,2020
1115298818919149569,say hi to the hydrogen economy get ready for ¢ renewable electricity steven chu says which could unleash hydrogen economy via,2019
1536684733458964483,hydrogen being allowed to ‘lag too far behind electricity’ for road transport,2022
1335565570029334533,imo the biggest thing the minister for climate action could do to cut our reliance on fossil fuels is to fund a pilot program into hydrogen use initially for electricity we need something stable to keep the lights on other than natural gas,2020
1396388454687141892,basf and rwe proposing gw offshore wind farm for green electricity and hydrogen for chemical industry,2021
1475981136538923010,hyundai engineering builds worlds st plant to produce hydrogen and electricity from carbon dioxide,2021
331438714138009600,earth the finnish hydrogen roadmap hydrogen to join electricity in ending traffic,2013
1541711753091977216,hydrogenready electricity plant proposed for st clair township,2022
1453995269201203205,sbri hydrogen business research innovation for decarbonisation competition to develop innovative solutions which support the objectives of the welsh government wales hydrogen pathway report find out more play button  netzero,2021
1372095713329487876, loudspeaker huge news weve taken a massive leap towards a hydrogen future with a £ million funding allocation confirmed today for hynet north west netzero decarbonisation  backhand index pointing right ,2021
1108376902320963586,a key benefit of cadent’s hydrogen blending project hydeploy is that it offers an opportunity to decarbonise gas here and now with little or no impact on customers and lay the foundation for a uk wide hydrogen economy,2019
1196307712663007232,crucial to decarbonise key sectors including heavy industry government could also play a role in the manufacture of hydrogen to replace naturalgas to heat buildings neither carboncapture nor hydrogen are currently cost competitive climatechange,2019
975759706131120129,according to forbes heating hydrogen and efficient homes will be the keys to deep decarbonization,2018
1183708769341054977,national laboratory recognised for new fuelling technology that can lower hydrogen costs and increase efficiency of dispensing hydrogen at refuelling stations hview decarbonise hydrogennow lowcarbon fuelcell,2019
1093155996913098752,some sneak preview of the upcoming european hydrogen roadmap from and to be released this week deep decarbonization green vs blue hydrogen no regret moves hardtoelectrify sectors stay tuned presented by n aldag from,2019
1414190231574630404,newyork announces initiatives to explore greenhydrogen for decarbonization netzero via,2021
1488135890937462790,witsbusinessschool professor lwazi ngubevana and policy expert neuma grobbelaar explore g members’ recognition of greenhydrogen as a key technology in decarbonising hardtoabate carbonintensive industries wbs,2022
1369635412285784067,india is turning to green hydrogen in a bid to decarbonize its economy,2021
1412783606309789697,governments wanting to reap the benefits of green hydrogen as a way to decarbonise must pay the price now hydrogen fuelcells netzero solutions even if carbon prices triple green hydrogen will still struggle to compete with fossil fuels via,2021
1589279300301344768,next to lead partner tobias faber associate kristina laewen also takes a leading role the project will generate green hydrogen from renewable energies and contribute significantly to the decarbonization of the industry read more below,2022
1567066764193693696,green hydrogen startup partners with to decarbonise longcross film studios,2022
1484173160291483649,leading partners join forces with to test sustainable data center innovations including fuelcell and liquid cooling technologies hydrogennow fuelcellsnow decarbonise fuelcells h hydrogennews hydrogeneconomy greenh hydrogen,2022
971876758206074881,what advantage hydrogen trains have over electric ones in a small country where it’s easy to electrify the tracks i’m not sure ilbut i’m all for a portfolio of decarbonization options in transport they do make sense for long haul freight in places like  Canada  though,2018
1603567609433280514,today we made decisions to assess the feasibility safety implications of utilizing clean renewable hydrogen as a decarbonization strategy for the natural gas system and hardtoelectrify industries,2022
1363899303740211201,a new partnership is looking to respond to the decarbonisation needs of the emiliaromagna region italy through the implementation of hydrogen,2021
1466343259400192001,update on application for m euro funding from the polish government for a plant in konin a coal phase out area an opportunity for to step in and create hydrogen from nonrecyclable plastics aid decarbonisation and create employment,2021
1471634999698878465,it also reveals how dfe intends to ‘work with the gas sector’ to trial ‘blue hydrogen’ and ‘decarbonised gas’,2021
1065580573748592640,latest report says must act decisively now to decarbonise heat,2018
984372649861242882,talking about decarbonisation of the gas sector through hydrogen,2018
1564337832516370434,cummins liter hydrogen engines in versatile’s equipment to lead the decarbonization of the agriculture market,2022
694451164792918016,airlines engineeringtechnologie nasa runway easyjet to trial hydrogen,2016
1262776772539662336,fun fact the wright brothers first flight couldve taken place entirely inside the sls liquid hydrogen tank,2020
333874389940572160,us navy drone flies two days straight using liquid hydrogen tank,2013
788823638635970560,plugging away inside massive sls fuel tank welders complete final plug fusion welds on sls liquid hydrogen tank,2016
770374843673948160,the deal is that we could also go for an adjustable wing except for the part about all of the hydrogen tanks i have to put in there,2016
747557894451662848,scientists just made it cheaper to produce hydrogen via sciencenews,2016
742323138017558528,towards ecofriendly industrialscale hydrogenproduction,2016
693989309381148673,a ‘nanoreactor’ may soon be producing hydrogen biofuel via,2016
757524978115964929,plz have a look at this hydrogen on demand technology can u advise ur experts to do trials of this,2016
1196837318893522944,bio medicine economizing on iridium iridium is an ideal catalyst for the electrolytic production of hydrogen from water—but it is extremely expensive but now a new kind of electrode made of highly porous… bioampmedicinenanomaterials via,2019
1320757125258350592,shared hydrogen campus man joins forces with nuremberg universities on plant,2020
1260911394255339520,let us focus on methanol as the preferred hydrogen fuel,2020
1296794195806564357,preparation of bushlike runioni foam catalyst and its performance in hydrogen production from sodium borohydride alcoholysis,2020
1609131972311547904,fuel cells and hydrogen production a volume in the encyclopedia of sustainability science and technology second edition en zlctyb,2022
1270684237151105024,exclusive rwe thyssenkrupp plan hydrogen production venture,2020
1270730923332550657,momentum is building for the highly anticipated an offshore hydrogen production and ccs vision led by has been appointed to support the front end engineering design and concept select work at the st fergus gas terminal,2020
453687789092364288,amazonica corp files combustion mixture patent relating to its hydrogen production technology,2014
894165439860944896,cheaper method of hydrogen production could bring fuelcell future closer,2017
