tweet_id,tweet_text,year
1252887305137913858,fruitful discussion with chairman ceo on how the eugreendeal can provide a unique opportunity for energy sector to achieve a costeffective energytransition greennewdeal renewables lowcarbon climateaction,2020
1539084257313927168,ultimate resource on blue and green hydrogen as alternative energy new york signs pact to pursue hydrogen hub plan in climate push eon australian billionaire aim to replace russian gas with hydrogen,2022
1594707533608153088,cop the roundtables focused on topics including just transition innovative finance investing in the future of energy green hydrogen food security water security and climate change and the sustainability of vulnerable communities,2022
1355076415901851649,im delighted to join tom van rensburg from partners from across europe on this incredibly exciting project itll transform our understanding of how greenhydrogen works on islands energy hydrogen renewableenergy solar,2021
1114048793933221888,what happens to the excess wind solar energy hydrogen enables large amounts of it to be stored longterm our silyzer generates green hydrogen from renewableenergy sources via pem electrolysis visit us booth d in hall hm,2019
1452429615457349637,based on projected costs of renewable energy in the low costs of solar energy in saudi mean that the cost differential between producing green hydrogen in the uk through electrolysis and importing green hydrogen in the form of ammonia is significant,2021
1519631163182227456,greenhydrogen – production via solar wind energy transport via existing pipelines use active heaters x hydrogen provides energydensity of naturalgas zerocarbon climatechange scenarioplanning valueproposition utilities europe vsec vsec,2022
1188975612343529473,johnny heath corpus christi affordable hydrogen fuel cells news to rid electric grid of carbon shore up green energy support,2019
1466362385057431558,rt euclimateaction rt eu india energy panel held yesterday to step up cooperation in  green circle energy efficiency  green circle renewable energy  green circle green hydrogen  green circle grid integration  green circle sustainable financing  green circle scale up cooperation with  backhand index pointing right …,2021
1183242408638607360,hydrogen needs to overcome the ‘blues’ before it’s accepted by automakers as the green energy alternative via,2019
1088018881443254277,labor promises to supercharge hydrogen industry as green groups say no role for coal energynews,2019
1406241488376274951,why hydrogen is the hottest thing in green energy,2021
1452433683852394496,hydrogen touted as solution in bluescopes long road to greensteel energy hydrogen australia business steel via,2021
1494612301348966403,while shares of adanigreenenergy and gail rose ntpc and indian oil corporation fell a day after the government announced the first part of national hydrogen policy,2022
1133722902484930561,all the more reason to store surplus energy in hydrogen,2019
1115551439554613248,hydrogen council and energy observer join forces gasworld,2019
1191730776280309761,lee rowland from on the potential for hydrogen to be transformational in the northwest hynet hydeploy hymotion npenergy,2019
819653145169199104,toshiba wins order of hydrogen based autonomous energy supply toshiba corporation,2017
1546564054449266688,studies showing hydrogen pipelines carry far more energy keep making the same mistakes,2022
1029205375617310720,french carmaker having experience in hydrogen fuelcells since with four hydrogen concepts will work on r d breakthroughs especially when it comes to cost theansweriswater electriccars energyindependence sustainability,2018
941391112832520192,how do i refuel a rasa energy usage compared to other h cars cnn piece on riversimple explains all tbt,2017
1155665496441647104,we met with evoenergy gas manager bruce hansen who shed some light on the build of a firstofitskind hydrogen test facility and its anticipated impact on gas supply both in the act and across australia,2019
1467552901983789057,each day ge makes big moves in aviation energy and health care the latest news features the first passenger flight to use sustainable aviation fuel a green hydrogen demo on long island an ai solution to help assess breathing tube placement axios,2021
1168095086518984704,clearly i have a vested interest of a concept for a h new turbine generator for evs in all applications to produce energy however i did not just arrive here in the present foray started with newsweek article hydrogen the fuel to take over from oil,2019
1515398639157493767,japan’s bet on hydrogen cars needs a jumpstart japan’s early moves to spur the adoption of fcevs have lost momentum rapid technological progress in batteries has eroded the range and refuelling advantages of fcevs bold mea energy,2022
492711287743213569,ca energy commission advances construction of hydrogen refueling and ev charging stations,2014
1569409811623854080,nothing about land use nothing about mass transit nothing about bikingwalkingrolling only stuff about ev cars and hypotheticals about hydrogen energy shortsighted leadership that is clueless to what steps can be taken today to cut peoples carbon footprints in half,2022
355337309861838848,us ceo hydrogen fcev have better welltowheels sustainability and are more energy efficient than bevs,2013
1302336149969567750,stimulus package will benefit hydrogen industry hydrogen will also accelerate the goal of carbon neutral by that gives confidence to produce costcompetitive hydrogen by the end of the decade cleanenergy,2020
1048206131322114048,japan takes a major step toward a hydrogenbased economy a japanese consortium has started the construction which is said to be the world’s largest hydrogenbased energy system — a step towards a hydrogenbased economy hydrogen cleanenergy,2018
1197953717749911557,copper could help unlock the cleanenergy potential of hydrogen fuel cells,2019
1383757458179383297,colorado state bringing hydrogen fuel station online to advance cleanenergy goals  backhand index pointing down ,2021
889616213818712068,will advertise its hydrogenfuelcell sedan with smogreducing billboards cleanair cleanenergy,2017
1368730329658310656,south korea is creating the world’s first hydrogenbased society cleanenergy southkorea fuelcell,2021
651397898425507840,supports extension of cleanenergynow tax incentives legislation hydrogen fuelcellls,2015
462635442991407104,halving hydrogen fuelcell catalyst cleanenergy,2014
1215647161473433601,treehugger does hydrogen have a role to play in a cleanenergy future,2020
1581934305638772737,galvanising hydrogen value chains for a net zero future h view carboncredit carbonneutral netzero carbonfarming carboncapture carbonmarket cleanenergy,2022
490552672626290688,the politics of renewable cleanenergy hydrogen fuel news  hydrogen fuel news,2014
1100851860842446848,the trick question is what in fact raises the attractiveness of hydrogen today and the straight forward answer is cheap renewables in combination with an electrolyzer on an industrial scale hydrogen cleanenergy energysystems,2019
1389853222186229762,the hydrogen analysis was carried out by a norwegian research company and ifpen a french petroleum institute with project management provided by energy renewables renewableenergy cleanenergy h sustainability,2021
1380401637508972545,why hydrogen energy has seduced a generation of politicians renewables cleanenergytransition,2021
998813254322409472,£m boost for uk’s hydrogen economy cleanenergy innovation hydrogenfuel energy,2018
973963133080539137,glad to have participated yesterday with a keynote presentation by yane lapercheriteau at the climate change solutions hydrogen and fuel cells conference in birmingham uk ccshfc fuelcell cleanenergy,2018
514805698564472832,if rockefellers can commit to cleanenergy can you climate hydrogen fuelcell energy investing,2014
1563180773590827008,receives million for new national energy research center  research will focus on hydrogen and its role in sustainable energy and information science hydrogennow hydrogeneconomy hydrogennews h cleanhydrogen cleanenergy,2022
1347929092528566272,science energy researchers take a key step toward a cleaner more sustainable production of hydrogen advance experimental tools used for an electrochemical catalytic process thats cleaner more sustainable than deriving hydrogen from natural gas,2021
1281555026830295040,the eu strategies for energysystemintegration and hydrogen will pave the way towards a more efficient and interconnected energysector driven by the twin goals of a cleaner planet and a stronger economy eugreendeal,2020
1546766467856842752,if you are looking to get in touch with our team to discuss any of our services you can give us a call on or visit or website for additional information renewableenergy hydrogen hydrogenwater fuelcell gasification energy cleanenergy greenenergy,2022
1587951181820829696,this is a special greenhydrogen report by sgkplanet scientists have said that h in many ways is the perfect fuel h will play a fundamental role in the fight against climate change hydrogen renewables cleanair air environment greenenergy cop,2022
1181979144093085696,bnef finds that hydrogen’s plunging price could boost its role in a carbonfree future bnef hydrogen carbonfree carbonfreefuture renewables renewableenergy carbonfreeenergy renewablehydrogen sustainablefuture energy greentech cleantech tech,2019
1425389093442183169,viritech publishes a call for action for uk hyrdogen connectinggreentalent careers energysector cleantech innovation,2021
1362050752231968770,xfls shareholder update  fire  pink current coming putting charles iggulden in charge of cycle is huge because it allows mike mclaren to focus exclusively on xfuels clean energy technology hydrogen cleanenergy oil ng,2021
1157753434088574976,new top story on hacker news germany turns to hydrogen in quest for clean energy economy,2019
1177479789747163136,japan planning institute inc embassy of france in japan hydrogen mobility development and clean energy policy in france jpi seminar november  tuesday,2019
1147220972996571141,japans clean energy quest could fuel australias hydrogen export industry via,2019
1105071666143608833,clean energy news australias bn national hydrogen plan news gasworld,2019
1357234883458957312,hydrogen the next clean energy frontier by,2021
361532907388538880,clean energy breakthrough scientists extract hydrogen gas from plants,2013
1018788857955799040,hydrogen could be a major clean energy export but first there is work to do via,2018
988768311365206016,hydrogen filling station in the eu why not in the gcc clean energy study tour germany hydrogeneconomy,2018
806498112936083456,clean energy solutions new materials designed to store hydrogen fuel more efficiently,2016
1040586451367469056,socalgas builds on clean energy advancements with hydrogen council membership fuelcellsworks,2018
1098488125075177474,mitsubishi estate invests in new hydrogen energy venture clean planet lenr google translate,2019
1011195399661604864,hydrogen energetics is not such a distant future as it seems now very soon mankind will have to go to the open ocean for huge reserves of clean wind energy for deep waters and strong waves the connection of wind farms to distribution networks will be v…,2018
1060758278332997632,the wpp collection unit cantake the waste and convert it into hydrogen which can be used for clean renewable and environmentally friendly end products wpp energy ico,2018
1567299749912674304,democrats like mary peltola for congress and i care a lot about the cost of energy did you know that the inflationreduction act contains provisions to lower energy cost by building hydrogen hubs alaska has abundant sources of clean hydrogen both renewable and fossilbased,2022
775315142062071808,algae engineered to produce hydrogen a possible clean source of energy according to tel aviv scientists renewable,2016
842620075995815936,scientists make use of solar energy to produce clean hydrogen from biomass science,2017
788394818661707776,prototype uses solar energy to generate hydrogen and clean water from polluted water,2016
1123965446426959873,etenergyworld innovation hydrogen harnessed from wastewater using sunlight to create clean fuel,2019
1125292391332585472,hydrogen can support transition to clean energy but the green quotient of hydrogens source needs validation most of commercially available hydrogen today is synthesized from methane gray hydrogen cleanenergy pollutionreduction hydrogen,2019
340474844531552258,scientists invent super clean hydrogen fuel technique could save us all applause supergreen energy carbon,2013
509033500780290048,tokyo olympic and paralympic games to shine green with utilization of clean hydrogen energy,2014
1384907607069036544,australia has potential to be ‘world leader’ in clean hydrogen and energy via,2021
338828402989600768,engineers devise new way to produce clean hydrogen hydrogen altenergy,2013
326798664091725824,rt researchers have developed a wonder nanomaterial that can produce energy clean water and hydrogen,2013
1113934058894000135,german ecar pioneer says cars should have smaller battery and hydrogen fuel cell clean energy wire,2019
535549532604743680,how a california cleantech firm revived again again when its big customers went bankrupt ev caenergy fuelcell,2014
1605128798718115841,hydrogen buses are coming to edmonton and area fuelling hopes for a new energy economy,2022
1208017800297533440,we are diversifying our energy basket with gas lng biofuels nextgen hydrogen to meet our energy objectives we are leapfrogging to bsvi grade fuels directly from bsiv panindia from april st and identifying ways to generate electricity from renewables,2019
1277625976554471425,hydrogen can help enhance the growth potential of renewable electricity considerably and widen the reach of renewable energy solutions,2020
1095419793195364352,pathways considered included renewable electricitybased marine fuels in the form of hydrogen ammonia emethanol egas oil and electricity for use in batteries bioenergy an equal mix of the two,2019
1450488044612579329,the hydrogen stream rolls royce rising prices and hydrogen fueled beer this week sees hydrogen pricing hit new highs driven by simultaneous jumps in the price of natural gas and electricity elsewhere project plans… solarenergy solarpv solar,2021
1085506957849518080,fahyence is the first fuel station in europe that produces hydrogen by electrolysis on site using green electricity from renewable energies renewables energy,2019
1006872627997265920,green energy would be boosted if excess electricity from wind and solar farms was used to produce hydrogen for use in heating and other parts of the energy system according to engineers gt,2018
1600070058763436033,scientists just made hydrogen out of nothing but air cleanenergy renewableenergy greenenergy energy solarpanels gogreen sustainability ecofriendly sustainableenergy electricity solarinstallation savetheplanet sustainable,2022
307650126720139264,fuelcell energy announces contract to convert landfill gas to ultraclean electricity heat and renewable hydrogen,2013
1425892350224740353,ana gonzalez hernandez shares an overview of hydrogen as an energy carrier and its uses production methods role in decarbonization sustainability pauto,2021
1207972097831718912,join as she finds out about smart testsolutions current trends in hydrogen energy as well as misconceptions in this exclusive interview with wolfgang neu the company’s founder ceo hview decarbonise hydrogennow fuelcell,2019
1455677897432309763,renewable energy can be stored as hydrogen to be easily used across our existing energy infrastructurewe are on cusp energy revolution that could see hydrogen play key role in way we bring fully decarbonized energy to our homes offices and factories,2021
1272903070305996805,korea ministry of trade industry and energy announces establishment of a krw billion hydrogen economy development fund hydrogen renewables decarbonise,2020
1004278545097678849,hydrogen buses mentioned at the as one of the applications which can help to decarbonise the energy transport system and integrate more renewable in the energy system eusew eusewvision,2018
1505894508462018560,our project partner is leading the development of efficient and costeffective procedure and reactors to charge hydrosil with hydrogen and test its potential for recycling waste plastics learn more  backhand index pointing right  solarfuels decarbonisation solarenergy,2022
1383914656612323330,green hydrogen could be a gamechanger if it can be used to decarbonise industries like steel making and shipping reports renewableenergy,2021
903325209461215248,unlocking the potential of hydrogen in a decarbonized energy system there is a growing…,2017
1524075017335721985,epri the city of houston and nyu urban future lab announce startup participants for the lowcarbon hydrogen accelerator hydrogennow hydrogeneconomy hydrogennews h cleanhydrogen decarbonise cleanenergy fuelcells,2022
878225811769237505,electrification together with clean hydrogen can help to decarbonise economies says windeurope renewableenergy,2017
1187672709137948680,speaks with ceo of raffinerieheide an oil company shifting its efforts towards cleaner energy through green hydrogen synthetic aviation fuel in this hviewexclusive hview decarbonise hydrogennow fuelcellsnow fuelcells,2019
1156897444010975235,etenergyworld hydrogen electrolyzer market expected to reach mn by,2019
1602218959901687808,iso adopts skorea’s hydrogen tank standards greenhydrogen hydrogen renewableenergy,2022
1193882634679656455,alkamem technology to open new markets for afc energy alkamemtm set to be a truly disruptive technology in field of alkaline water electrolysis with evidence supporting a sizable increase in hydrogen production efficiency hydrogennow fuelcell,2019
1333814944761073668,eurowind energy and danish stateowned have today unveiled plans to establish what they claim to be one of the world’s largest greenhydrogen production plants in denmark hview hydrogennow,2020
1502293405078102022,risenenergy wins bid to supply mm w pv modules to sinopecs greenhydrogen demonstration project in xinjiang the project is on track to become the worlds largest pvbased hydrogen production facility hydrogennow greenh h hydrogennews,2022
1447860880939573250,totalenergies co’s scotwind plan includes industrialscale hydrogen production offshorewind renewableenergy greenhydrogen hydrogen,2021
512320386739220480,new hydrogen production method could help store renewable energy huffgreen,2014
1480480175917658117,siemens energy kk and toray industries inc have entered into a partnership to create green hydrogen production technology its adopted by the green innovation fund project of the ministry of economy trade and industry and nedo,2022
1560576389618606080,the belledune port authority bpa and cross river infrastructure partners have reached an agreement in principle for the development of a green hydrogen production facility at the northern new brunswick port hydrogen energy renewableenergy,2022
1513937959069888524,seoul to develop renewable energy technology using sewage sludge for green hydrogen production hydrogencentral hydrogennews hydrogen fuelcell hydrogeneconomy hydrogenmarket,2022
1070040821930577920,inorganictuesday iron phosphide fep electrocatalysts derived from a molecular fep precursor for watersplitting hydrogen production from watersplitting represents the most promising solution for a clean recyclable and lowcost energy source,2018
1595382738634379265,renewablehydrogen can play a prominent role in decarbonising energyintensive  high voltage industries as well as heavyduty or longdistance transport  articulated lorry  modes learn more about hydrogen production innovation and financing here  right arrow ,2022
1591258176099586049,mckinsey to release new insights on hydrogen production and energy transition,2022
1601219829801050112,technologies demonstrates firstofitskind iridiumfree pem electrolyzer for hydrogen production mark mcgough newsmedia news industrialnews readmagazineenergyindustry,2022
1146814437749379072,industry is part of the global equation for energy transition its a good sign that bmw announced the production of hydrogen fuelcells  clapping hands  clapping hands ,2019
1161273898647920640,globalinvest today trading tipp stay focuse on hydrogen and fuelcell market but wait for nelasa q numbers bloomenergy shock market with numbers and this is outgoing to the fcel h sektor,2019
1556597470959910913,first on todays visit was based in annan global specialists in heat and energy solutions they discussed their ambitions for future technical improvements hydrogen and bringing young people into the world of engineering nset,2022
803519497248247808,andrea want ed renewable hydrogen energy the pilbaras next global industry very exciting for karratha thenewpilbara,2016
1140731469637120000,“australia could capitalise on lowcarbon exports such as hydrogen produced by renewable energy countering the decline in global demand for our fossil fuels exports”,2019
1319740770803474433,icymi energysource innovation stream hosted benny oeyen of to discuss their comprehensive approach to supporting the development of a global hydrogen economy read the recap and watch the webcast,2020
1316538595545497600,small caps global energy ventures unveils compressed hydrogen ship to transport clean energy hydrogen cleanenergy,2020
1447581027401146371,the uk and india are set to collaborate on green hydrogen production as part of a recently strengthened agreement focused on accelerating the move to global clean energy in the decade ahead,2021
906065947089190912,global hydrogen electrolyzer market mcphy energy sa hydrogenics corp tianjin mainland hydrogen equipment…,2017
854070001283866628,of global energy consumption is used to produce hydrogen gas for haberbosch process which generates gt million tonnes of ammoniayear,2017
1366792620182294528,the worlds first global interactive hydrogen dashboard and map has arrived a cuttingedge immersive tool to help all energyprofessionals understand the scope and growth of the hydrogeneconomy read about its release here and start using the tool today,2021
1397622500599627776,hydrogen is set to play a growing role in a changing energy system driven by mobilised government actions funding expects global production volumes to reach mt by get your free insights now,2021
542334330849075201,record efficiency for converting solar energy to hydrogen without rare metals gizmag,2014
542615103451844608,solar news record efficiency for converting solar energy to hydrogen without rare metals…,2014
1409912695768428553,th century energy guess what your missing josh your metals rare earths lithium after ripped from earth will run out around what then hydrogen fossils again they are the future in a different form so much more esg friendly than evs,2021
1336019260892737537,breakthrough research on hydrogenmetal systems for clean energy horizon,2020
1039559430512279554, calendar  china international import expo newenergy vehicles will capture great attention honda of japan told yicai that the companys hydrogen fuel cell vehicle the clarity fuel cell will be on display,2018
1080624585244954624,china leads the world in electric vehicles is now pursuing hydrogen fuel cell technologies it is all about optionality to improve energy security  China  does not want to be dependent on fossil fuel imports eg oil thermal coal by,2019
908835761700638720,electricvehicles have an energy problem — hydrogen may be the answer evs,2017
1113862591753932802,energy superhub oxford is developing hybrid charging stations for hydrogen fuel cell vehicles industrialstrategy smartenergy cleangrowth,2019
1504376635805822978,green hydrogen according to honorable minister mr nitin gadkari may be produced using renewable energy and readily available biomass he also stated that opting for green fuel will help in bringing a clean and affordable future to india nitingadkari hydrogenvehicle,2022
1553015757151375361,green energy industry is a fallacy wind is unreliable requires the burial of non recyclable turbine blades electric vehicles lack infrastructure require the disposal of millions of toxic batteries government has ignored hydrogen fuel for vehicles,2022
1275827988312068096,mobile energy global meg has today said it will rename to medici motor works mmw as part of its expansion program that features hydrogen fuelcell vehicles hview fcevs,2020
1528420190916165633,what ever the new energy is it needs to be something we can retro fit our existing vehicles hydrogen fits this requirement,2022
1420355744055144454,has started up europe’s largest hydrogen electrolyser of its kind at its energy and chemicals park rheinland in germany pemelectrolyser bluehydrogen greenhydrogen,2021
1486428752812908545,we cannot allow myth of blue hydrogen being a clean energy to be part of future of this island producing hydrogen is carbonintensive process requiring large amounts of natural gas that would come from drilling and fracking in ni burstbluehydrogenbubble banpetroleumlicensing,2022
940824200926973959, microscope  project part of the hydrogen research and development program carried out by sarawak energy berhad in china,2017
1418269612668563464,exciting new development–new energy ventures have partnered with perspectum drone inspection services to utilize their dronebasedai driven technology to search for natural hydrogen helios goldhydrogen naturalhydrogen hydrogennow learn more,2021
1458328752539197445,renu energy takes off on hydrogen purchase asxrne,2021
1419501499051245570,british universities explore converting ocean energy into hydrogen and ammonia,2021
