tweet_id,tweet_text,year
644443840594624512,toyota launches mirai fueled by hydrogen japanese car giant toyota launched on monday at the frankfurt auto,2015
535102167909425152,hydrogen fuel cell phone charger upp launches in uk apple stores,2014
1186020166817275905,doosan mobility innovation launches ‘hydrogen fuel cell pack for drones’,2019
730662587650707456,world’s first hydrogen carsharing program to launch in munich this summer,2016
1561404499012493315,cooperation sealed toyota and bmw launch hydrogen cars,2022
476452702826684416,hydrogen car news report – toyota to launch hydrogen car in after unveiling the prototype of it carkit,2014
444600648735395841,could launch next generation fuelcell car in hydrogen h bclass fcell,2014
1595748857371148292,dekra positioned for the future thanks to focus on safety security and sustainability photo dekra dekra germany future focus safety security sustainability hydrogen spain costarica market launch rental fleet ai,2022
1582305293471735808,hello hydrogen campaign launched to tackle lack of choice for future home heating,2022
690224757388738560,honda to launch hydrogen fuelcell car in california this year,2016
690190159044739072,honda to launch hydrogen fuelcell car in california this year,2016
1298228261265084417,eneos jera launch japans largestscale hydrogen station in tokyo,2020
1564451830360207360,india has launched its own first hydrogen bus what is the rest of the world doing theyre keep busy in meetings and conferences climateactionnow enoughofspeeches,2022
1135481566010982400,solar news rt pvmagazine rt pvmagazineoz queensland launches million hydrogen strategy the queensland government has launched a fiveyear plan to help drive the development of a renewable hydrogen industry and create more highly skilled jobs and export opportunitie…,2019
527455885077917697,launches h refuel hprize competition for smallscale hydrogen refueling systems,2014
883366587218178048,launch of emotion’s first fuel cell electric buses hydrogen buses at public transport operator fuelcellsworks,2017
1368579383678693379,saudi arabia pushes ahead with plan to be world’s top ‘green hydrogen’ producer dubai the first independent digital banking platform in the united arab emirates launched on sunday a neobank hoping to become a leader in the middle east africa and south asia dubai,2021
839041089667465217,the new hyundai hydrogen fuel car launching in genevamotorshow,2017
1254452721698189314,ntpc to launch hydrogen fuel cell buses cars in delhi leh news,2020
1288146197224579072,the uk government has announced the launch of a hydrogen advisory council representing a significant part of its decarbonisation plans,2020
1412015408559894530,london launches england’s first hydrogen doubledeckers,2021
1458546256276451330,theshortreport highlights has launched a m funding opportunity for indigenous health research and will collaborate to build hydrogen production hubs for more read the article here,2021
431962626717798400,university launches innovative hydrogen car in india hydrogenfuelcell masstransitvehicle hydrogencar,2014
353488890679668736,international consortium launches governmentsupported study on hydrogen vehicle refueling infrastructure in f,2013
730015990537408512,government launches £ million competition to promote rollout of hydrogenfuelled fleet vehicles,2016
615411401637666816,iea  electric plug  this week in energy we launch our hydrogen technology roadmap plug into our feed recharge your knowledg…,2015
826016608690790400,hydrogen council launched in davos energy central hydrogenfuelcell,2017
334329795846496257,online map of uk hydrogen capabilities a collaborative british network has launched the fir renewableenergy,2013
1121021083824603136,rt impakterdotcom rt paoloottaviani hes energy systems has officially launched the hycopter a hydrogen electric multirotor drone capable of hovering for hours at a time via impakterdotcom,2019
1311327568491171842,ralph northam has signed a new law that designates dedicated funding for hampton roads transit the largest bus network in the commonwealth while simultaneously launching six new zeroemissions ev buses for the network a first for the state,2020
1502274872273158146,dft launches ukshore to take maritime ‘back to the future’ with green investment £ million new funding to accelerate research into and development of clean maritime technologies hydrogennow hydrogeneconomy hydrogen decarbonise cleanenergy uk,2022
1479348328873836546,australia signs defence treaty with japan launches hydrogen trade program auspol australiapm,2022
1397684225298604032,wakeup now eur tgt eur launches first hydrogen innovation center italy hub will be created in modena in collaboration with other partnerships with italian and international organisations will follow,2021
334417690095669248,this liquid hydrogen uav just flew for two days straight,2013
668994844178563072,thanks for the follow check out this hot new video from sevenpoint on the power of hydrogen,2015
644596018995040256,inspec solutions congratulate itm power on the opening of the hydrogen filling station at the amrc at catcliffe,2015
560796393254551552,marketwatch npwz news neah power systems announces formira hydrogenondemand cover feature on automotive industries stockwatch,2015
1330633453725999106,this flying car is powered by hydrogen,2020
1269976708997885953,has significantly expanded its manufacturing capacities and can now produce electrolysis cells with a total power consumption of up to one gigawatt per year together with its strategic supplier and joint venture partner de nora hydrogen,2020
1222497297386409984,tokyo to power olympic torch with hydrogen for first time file photo the olympic torch of the tokyo,2020
1318756148028166144,tesla powerwall rival seeks to bring hydrogen into your home,2020
625772541190078464,plug power acquires full control of ‘hypulsion’ hydrogen and fuel cell business in europe materialhandling,2015
1245434050837446656, Japan  a bus company in iwaki city introduced a fuel cell bus powered by hydrogen for the first time in tohoku and started operating in the city from the st  backhand index pointing right light skin tone ,2020
916127941687463937,new nanomaterial pulls hydrogen from seawater to power fuel cells,2017
309838498800758784,the plan on californias north coast is to turn timber byproducts into hydrogen to later power fuel cells with,2013
1539514860723216384,powercell receives megawatt fuel cell system order for towboat worth approximately msek  flexed biceps  Sweden  hydrogen,2022
1594714839754199042,news double exclamation mark  alkaline fuel cell power closes convertible note financing pwwr alkff investing smallcap stock hydrogen,2022
709314363530674176,toyota partners in making windpower hydrogen for fuel cells topnews,2016
1187127874828066822,cow power toyota’s new car can run on hydrogen from irish manure,2019
636277321385791488,garbage in power out let ont convert landfill gas to hydrogen fuel,2015
659446603250536448,hydrogen fuel cell powered iphone dont hold your breath for it,2015
1288148288223555585,microsoft used hydrogen fuel cells to power a data center for two days straight engadget,2020
1339112624018087936,nordic unmanned demonstrates hydrogen fuel cell powered drone,2020
1310580524327591936,the ‘world’s first’ hydrogen fuel cellpowered flight has taken off in cranfield,2020
1183028063262728193,the hydrogen fuel cellpowered suv only emits water and percent filtered oxygen,2019
1179795512129703937,over the last two weeks springboro high school students in mr broderick’s principle of engineering class project lead the way pltw have been trying to get the most speed out of a little power the challenge was to use two hydrogen fuel cells springboro schools,2019
849881301582700546,amazon acquires stake in hydrogen fuel cell maker plug power plans to spend m on…,2017
1470697761465151490,innovative hydrogen fuel cell powered mobility solutions will enter the taiwan market as part of a new memorandum of understanding mou signed with mitacsynnex group unveiled today dec hydrogennow hview,2021
343337310017966080,boms fiat rejects hydrogen fuel cell power,2013
390132018270326784,macro view of old oil tech and nuclear fading away as hydrogen fuel cell acre mw power plants surge iown fcel,2013
1557395064103518208,hydrogen fuel cell stocks ballard power systems plug miss earnings views,2022
1313933907692343300,toyota teaming with hitachi to build hydrogen fuel cell powered locomotives,2020
659262290051530752,auto power play japans hydrogen car vs chinas battery drive by norihiko shirouzu and paul lienert tokyode,2015
591447756620886017,pee power could fuel hydrogen cars,2015
586205715678781440,pee power could fuel hydrogen cars,2015
585918916070879232,pee power could fuel hydrogen cars,2015
586311405130932224,pee power could fuel hydrogen cars,2015
1314158664715046912,its national hydrogen and fuel cell day dont miss our ad in september issue access the full magazine hday hydrogenday hydrogenfuelcell mobility power technology hview,2020
302564415172132864,the future finally a fuel cell may help overcome the problems of a batterypowered car notably limited range,2013
1311018700309438466,appleinsider future macbook or ipad models could have power for weeks using hydrogen fuel cells,2020
549817328666689536,hydrogen will power our diesel locomotives in the future its just around the corner in years if not less the ground work is there,2014
1398670877814935553,heres an interesting innovation in flight technology hgo power seeks to power drones with hydrogen could this be the future of air travel check it out,2021
1002099211406585856,renewable hydrogen a new market for wind power carlvonossietzkyuniversitätoldenburg,2018
1033021444085698560,csiro australias national research agency released a national hydrogen roadmap that provides a blueprint for the development of a hydrogen industry hydrogen renewables powertogas renewablehydrogen,2018
1197827200705155074,nissanmotorcoltd hondamotorcoltd toyotamotorcorp a lightweight car powered by hydrogen could change the way we think about driving,2019
1200771096070496257,german gas industry targets gw of powertogas capacity in five years  Germany  hydrogen  Germany ,2019
1204979554001006592,top story la wants a hydrogenfueled power plant its never been done los angeles times see more,2019
926431597318082560,designboom pragma industries alpha model is a powerful hydrogenfueled bike,2017
369382033245483008,hydrogen to power mobile towers hydrogen stationarypower telecom,2013
629698985414950912,hydrogen power could actually make sf commutes suck less,2015
1245416159920287745,hydrogen power and carwashing drones patents show where carmakers’ thoughts are going,2020
1343666325898616832,very keen to learn more about hydrogen power,2020
1336292700996382722,hydrogen power firms join forces in bid to lower costs,2020
1336196971149877248,hydrogen power firms join forces in bid to lower costs,2020
1324358555118559233,mad dash cramer on cnbc linde is merging into the worlds largest industrial gas company is backing hydrogen power in a big way in ca china lin just saying on s with and,2020
739452252469891072,tokyos olympic bet on hydrogen power the city is spending big money to make fuel cells affordable is that the…,2016
535980560410091520,i drove the mirai toyotas massive bet on hydrogen power via,2014
1560261208078708739,toyota gr yaris h takes hydrogen power to the world rally championship,2022
1328414426370871296,uk prepares to make ‘big bet’ on hydrogen power via ceres power is a uk based hydrogen fuel cell company hydrogen is shaping up to be a key contender es,2020
579689143640313857,prime consulting alliance money business capital smogbeater first hydrogen powered tram developed in,2015
575697329702965248,who knows what is about about to happen about to demonstrate his hydrogen powered iot,2015
640402925278334976,auvsi horizon unveils the worlds first hydrogen powered hendurance multi …,2015
654321542227083264,hydrogen powered bike brings long range without batteries gt,2015
648301119647694848,hydrogen powered olympics for tokyo,2015
660346343748149248,sas hydrogen powered drone prototype flies high uav,2015
1226657738790449153,hydrogen powered superyacht ⁦  smiling face with sunglasses ,2020
1227358011775160320,sinot aqua full hydrogen powered yacht concept,2020
1319304637116256259,𝗛𝗼𝘄 𝗶𝘁 𝘀𝘁𝗮𝗿𝘁𝗲𝗱 𝗛𝗼𝘄 𝗶𝘁𝘀 𝗴𝗼𝗶𝗻𝗴 the new popemobile is a toyota hydrogen powered car hydrogennow,2020
536497065392865280,the new hydrogen powered car toyota mirai is quite attractive the price tag isnt,2014
395267100488380416,this is toyotas production fcvr hydrogen powered sedan,2013
742183624066367488,gadgets toyotahydrogen toyota hydrogen powered car to compete directly with tesla,2016
529831355396263937,hydro bike sporty hydrogen powered bike design,2014
529842306879213568,hydro bike sporty hydrogen powered bike design,2014
534701107101331457,announces hydrogen powered car fall roll out in ca and northeast engineering,2014
489360457342681088,got an hydrogen powered car wheels ahoy thanks to sabrina sartori from the university of oslo,2014
1205261942874660864,hydrogen powered cruise ship hotel complex in the maldives we are developing a hydrogen powered cruise ship hotel in the republic of maldives and we are seeking investors interested in a joint venture with,2019
1203950376808067072,the rasa a hydrogen powered car that emits water instead of carbon dioxide,2019
1193549049196109826,navy accepts firstofitskind hydrogen powered uas,2019
852722471220514816,hydrogen powered uiuc mechanical engineering student elaborates on their entry for the shell…,2017
1415954323499102213,our friends at spoke to nikolas iwan ceo of h mobility about the potential of hydrogen powered mobility in germany the advancements of policies that would propel its growth and what other countries are doing in this space,2021
1396857687397343236,did you know over the past weeks brand new state of the art hydrogen powered buses have started being introduced on the between east acton oxford circus these only emit water nothing else feature led displays and systems such as digital mirrors to make the bus safer,2021
973752785521983488,if there were only some other way to build and operate a steel foudry they gave us abba and volvo now they want hydrogen powered steel plants auspol,2018
1068187947806146560,in our new guest blog see why andrew barker managing director of believes the constructionindustry should be looking at hydrogen powered lighting this winter,2018
1543411363858481152,oil india limited completes beta demo of hydrogen powered bus developed under its startup programme sneh,2022
687174214458163200,the audi htron is a hydrogen powered suv,2016
719599606607257600,bringing some hydrogen powered commotion to br riversimple rasa,2016
689075280057532417,hydrogen powered mercedes glc in the works,2016
804357247581257728,watch the worlds first hydrogen powered bus unveiled by in air pollution crackdown,2016
702116558122967041,‘riversimple rasa’ — a beautiful hydrogen powered car created here in wales via lunchtimelink,2016
668723356007424000,is this the hydrogen powered ebike of the future via,2015
825402764993912834,all countries could grew a part each then we can use oil anyhow and change to hydrogen power later the man develops this will be rich,2017
840633920022540288,i liked a video from oni day colony and hydrogen power generation ep,2017
1405251242931245060,ge technology to power australias first dualfuel gas and hydrogen power plant ge news,2021
1365324753871859717,hydrogen power where we’ve been and where we’re going,2021
1050448379501785089,say what you want but kw just showed a prototype for a hydrogen power plane on live tv if you dont see the implications of this stay asleep engineers have been killed for building like models help humanity yet the greedy corrupt have always prevailed no more,2018
1049068398489919488,great progress for the hydrogen power in australia nel awarded contract for australia’s first hydrogen microgrid via source amp distribution,2018
1587110426030088194,uk has fallen behind in hydrogen power race says johnson matthey chief financial times,2022
770652414395416576,general motors reveals a chevrolet colorado pickup that runs on hydrogen power,2016
672523181945565184,hydrogen use wind to produce power use with water to produce hydrogen for transport efficient no lossesyes,2015
720044168026849280,future transport aberdeen’s hydrogen buses help swing boc fuel cell deal for itm power via,2016
1250353636565118976,a solarpower europe report sees europe achieving carbonneutrality before with solar power shares of above and largescale hydrogen use,2020
1181513759392718848,the workable ecological solutions are improved solar power harvesting hydrogen fuel cells carbon capture and factorylab grown meat net carbon neutral simples,2019
450539303006138368,hysr developing solarpowered nano particle system that mimics photosynthesis to separate hydrogen from from water,2014
895109910580543488,the hydrogen house is north americas first regulationapproved solarhydrogen powered residence,2017
857537584435789824,hydrogen solar and kite power will drive in its threeyear roundtheworld voyage,2017
816026792230342661,indias new solar power tree takes up only square feet and produces enough hydrogen in their own superior intelligence,2017
842474295674650624,scientists from are using solarpower to produce hydrogen from biomass via,2017
1430493757523349504,fascinating placed an order for eight container ships that will run on liquid fuel emethanol created by danish startup reintegrate using solar power to produce hydrogen then combining it with recycled co ht,2021
334880880139067392,nist demonstrates significant improvement in the performance of solarpoweredhydrogen generation,2013
706146929630191617,retweeted solar power hydrogen breakthrough water splitting at technion,2016
1341355195394093056,only reason hydrogen is getting pumped is because of the oil wankers if you really really want money back into your pockets then go all electric or if you belive msm power your home from collecting the hydrogen yourself from your hydrogen panels on the roof rolling on the floor laughing  rolling on the floor laughing  rolling on the floor laughing  rolling on the floor laughing  rolling on the floor laughing ,2020
553212262153191424,hydrogen fuel cells have been touted as the next big thing in powering electric lifttruc,2015
659316767672545280,mercedes unveils autonomous vision tokyo concept the vision tokyo concept is powered by a hydrogenelectric d,2015
1580103918478331904,italianbased bus manufacturer rampini carlo has unveiled its first hydrogenelectric bus powered by fuel cells in another stride away from dieselpowered bus production hydrogennow hview,2022
992182069424992256,anheuserbusch ditching diesel orders up to hydrogenelectric semis from nikola power,2018
686583834071150592,audis hydrogenfueled htron concept powers all wheels with electric drive cnet technology audis hydrogenfue…,2016
1524852190510186496,gas electric testifies climate action hearing that “all above strategy” is needed to maintain affordability reliability and safety adds that a diverse fuel mix including hydrogen gas renewable gas and nuclear power is needed for a smooth transition,2022
1284130612555788292,tunein next tuesday ceo andy marsh will make an appearance on tune in at pm et as andy discusses hydrogenfuelcells and how they can help us reach a more sustainable future along with other exciting plug power initiatives and topics,2020
1297202450307350529,the largest greenhydrogen trial in australia is underway with government approval a year plan to demonstrate the feasibility of powertogas technology  seedling  light bulb  right arrow ,2020
1370038796071354368,ceraweek experts say “green” hydrogen prospects depend on renewable power costs ihs markit by ⁦,2021
462156655866548224,green light for second station itm power’s us subsidiary has received approval for its second hydrogen refuel,2014
421112714589523968,toyota introduces its fcv a hydrogen powered car thatll debut in would you pay k the green ride,2014
1171490416249589760,new post the herald glasgow endorses hydrogen power as it turns its fleet green has been published,2019
1452763800143376386,proud to listen to our eu comission president about our innovation project power to green hydrogen mallorca greenhysland st spanish green h real ecosystem hub with our partners amazing a través de,2021
1582301624596594688,analyst sees gw of offshore wind in latin america by midcentury driven by green hydrogen not connected to power grids,2022
1562797819798306816,amazon signs green hydrogen supply deal with plug power,2022
1562853202566922241, green circle  amazon taps plug power for green hydrogen supply amzn plug,2022
1338288151958315008,in partial response alberta has said it will seek to use its natural gas to produce export hydrogen a nongreenhouse gas but there are obstacles hydrogen is harder to transport and solar power may soon replace natural gas in producing it akoil,2020
1094627670858424325,greenhydrogen some say its the fuel of the future we’re excited to be shaping this future with our partners in dubai as we break ground on the st solarpowered green hydrogen project in mena siemens,2019
1365050556692144131,plug power will invest million in the construction of a stateoftheart green hydrogen fuel production facility and electric substation in genesee county,2021
829028609595674624,india looking at green power solution from belgium times of india hydrogen hidrógeno,2017
929723169388351493,daimler and hpe want to power green data centers with hydrogen charlesmilander entrepreneur nyc,2017
929650212972453893,daimler and hpe want to power green data centers with hydrogen,2017
1601240872766554116,were looking forward to showcasing here on monday towards a european hydrogen ecosystem  blue circle organised by  blue circle keynote speeches by and  backhand index pointing right  repowereu eugreendeal hydrogenstrategy,2022
950532154450210818,autocarhyundai nexo hydrogen fuel cellpowered suv revealed at ces hyundai has,2018
852367214921560064,prototype genesis suv melds hydrogen and plugin power it hasnt even been two years since hyundai spun out i,2017
661397407591235584,hydrogen cars japans waterpowered revolution,2015
436957171268325376,a poopowered car scientists at uc irvine are turning sewage into hydrogen if hydrogen cars are going to be,2014
455976897097134080,hydrogen car news auto manufacturers hydrogen cars could hit roads by next year hydrogen fuel cellpowered,2014
496251346769543169,toyota hydrogen power touted for bmw i a technical cooperation between toyota and bmw promises cars car auto,2014
535102974121762816,hydrogen powered cars are here but building the infrastructure is key,2014
1184449859924815880,although hydrogen powered cars have been made storing hydrogen to make it as efficient as gasoline is tough to make hydrogen a widely used fuel several standards must be met four different ways of storing hydrogen are discussed below,2019
882056809133027328,why hydrogen powered cars really suck,2017
607731613078847488,video are hydrogen powered cars the future,2015
385921423220277248,hydrogen the car fuel of the future could hydrogen power the cars of tomorrow,2013
433034212635971585,why not build australian electric or hydrogen powered cars because no capitalist could get a loan from a private bank to do that,2014
1548019077519536128,hyundai has unveiled two stunning concept cars the rne drops a hint for a potential hot n version of the upcoming ioniq the n vision is an angular seventiesstyled coupe powered by a hydrogen fuel cell,2022
808323080133218304,hydrogen fuel cells vs batteries how to power the trains of tomorrow,2016
1330158262315085829,hexagon purus to supply composite highpressure cylinders for the development of the first hydrogen powered commuter train in the us,2020
979677309920862209,are hydrogen powered trains the future of rail see my article on this subject on the world steel association website photo is the new coradia ilint train developed by alstom,2018
1534922156450062336,hydrogenfuelcellelectric powertrains ordered to retrofit cessnas to make them electric wws windwatersolar,2022
1535404482774847493,germany  Germany  has some of most environmentally friendly trains in the world they are powered by hydrogen and oxygen the only waste they produce is water we have the solutions time to ditch fossil fuels implement them actonclimate climateemergency climate greennewdeal,2022
1384864121594724353,airbus pioneers a superconducting powertrain cooled by liquid hydrogen,2021
950316346092466176,hyundai reveals new suv powered by hydrogen at ces – and fcev will do miles on one fill up itm hydrogen,2018
880019487533223936,point by hugo spowers ev infrastructure easy at low penetration of evs but harder with high penetration hydrogen the opposite,2017
696708852956291072,scientist and engineers are increasingly considering using solarpower to create cleanburning hydrogen gas,2016
1537271833111560192,canada’s clean hydrogen gets set to power the world via,2022
934911353067683841,i want to create a motor that is powered by liquid hydrogen and liquid oxygen such as a rocket but instead of jet propulsion the motor would use the combustion just like a typical gasoline motor,2017
1201695250026094592,brunei starts shipping hydrogen to japan to be used in power generation hydrogen electricity brunei japan,2019
