tweet_id,tweet_text,year,tiffany,kishen,deepak,majority_rating,final_rating
1008017608141082625,q let’s think beyond just solar panels what are some of the most interesting sustainable technologies that already exist today have you used or seen any of them solarpunkchat,2018,1,1,0,0,
1473669379615297544,why isnt the uk in the lead developing sustainable electric aircraft,2021,1,1,0,0,
1451320590581866498,edinburgh airport partners with ørsted to bring sustainable air travel to the uk hydrogen included duncanclark,2021,1,1,0,1,
1056946033144578048,“we will introduce a new tax on the manufacture and import of plastic packaging which contains less than recycled plastic… …transforming the economics of sustainable packaging we will consult on the detail and implementation timetable” budget,2018,1,1,0,0,
1557371848794546176,ciac is pleased to see several key elements for our sector in ontario budget such as an advanced manufacturing low carbon hydrogen and a critical minerals strategy we congratulate on the budget read more here,2022,1,0,1,1,
1178363712610000897,explosions and subsidies why hydrogen is struggling to catch on in korea,2019,1,1,0,1,
1187549746283585536,red cancels hydrogen phone project as founder jim jannard retires,2019,1,0,0,0,
1138575236184461313,the perfect storm hydrogen gains ground on lng as alternative fuel,2019,1,0,1,1,
358210638834704384,bristol hails uks first hydrogenfuelled ferry,2013,1,0,1,1,
1287779968202801158,our ceo mary grant shows that working with customers such and and industry partners and eminox ltd porterbrook is supporting the green recovery teamporterbrook greenrecovery,2020,1,0,0,0,
852842300631863296,happy easter from bright green hydrogen easterweekend,2017,1,1,0,0,
1466351761908805634,news hysr sunhydrogen shares video highlighting differences advantages of its nanoparticlebased green hydrogen technology over conventional electrolyzers mwn stocks imgn aabb aphlf prrsf via,2021,1,0,1,1,
1447271032746827778,good results from swiss attempts to turn mixed plastic waste into natural gas a polycarbonatepolyesterpolyolefin feed simulating mixed waste gave yield of methane when treated with hydrogen using a ruthenium catalyst but green hydrogen is needed the catalyst is expensive,2021,1,1,0,1,
1098002138402156545,green hydrogen push bearing fruit,2019,1,1,0,0,
1325535909429719040,steel is a climate nightmare sweden has a plan to make it green huffpost,2020,1,1,0,1,
1179660200615260161,river kalamu in kinshasa drc is flowing plastics instead of water plastic pollution is an increasing problem in africa we need to join hands to beatplasticpollution apply now to become a green climate campaigner join the fight against climatechange,2019,1,1,0,0,
1217389468518404097,of millennials are willing to pay more for sustainable goods interesting and hopeful stats from this morning at business tourism sustainability workshop makeitgreen,2020,1,1,0,0,
1186489198183931907,ok back to listing things that make me relive trauma most social media apps two lady gaga ex’s sport tournaments most of my friends moms birdcages summercamps my favourite bookstore my cursed dress significant amounts of my underwear and green hair dye parallel parking,2019,1,1,0,0,
935543435997544449,hydrogen is not green at all that why big oil loves it think fracking boondoggle fracking,2017,1,1,0,1,
1405600819433644034,fantastic news that is building a plant in the heart of uk fusion at nuclear fusion is an exciting innovation that could supercharge our efforts to buildbackgreener 🇬🇧,2021,1,1,0,0,
963270861724758016,so difficult dont have the album read it times years ago so ru is the machine dragon having kinda frogg robot and a copy of himself that tries to be him so hetket relic purple green suplement to hydrogen to cause mortstromm contained hydrogen sehkmet hetket,2018,1,1,0,0,
1525119105661018112,off shore turbines could desalinate water and create hydrogen and oxygen supplies for green good,2022,1,0,1,1,
845474841926950912,bcga welcomes move to open the road to hydrogen mobility,2017,1,1,0,1,
817024108613562368,artificial leaf converts sunlight into hydrogen –,2017,1,1,0,1,
1575138694415130630,on september th hear about the support rwi received in the lowcarbonh accelerator join the final showcase with to learn more about rwis syntheticdata and other hydrogentech,2022,1,0,0,0,
1607843827519295488,steammethane reforming is the most common and economical way to make hydrogen gas on a large scale methane from natural gas is combined with hightemperature steam and a catalyst to create pure hydrogen and carbon dioxide,2022,1,0,1,1,
1526478326642233344,some really great contributions today exciting to see the broad efforts pushing hydrogen in every region very strong in badenwürttemberg,2022,1,0,1,1,
453129441246715904,cars of the future via,2014,0,0,1,1,
834178915287568385,todays cars emit co tomorrows cars will eat it futuretech hydrogen carbondioxide,2017,1,0,1,1,
508741652471484416,cars deals fly racing mens lite hydrogen jersey,2014,1,1,0,0,
689370603644547072,sapid reasons in preference to using hydrogen as long as cars qrhikqcr,2016,1,1,0,1,
1029632024955551745,how can the uk approach the infrastructure challenges that banning all new petrol and diesels cars from will bring eti programme manager rebecca sweeney explores this topic with uk lowcarbon transport,2018,1,1,0,0,
565947047287590913,electric cars are so yesterday abcnewsbayarea michaelfinney onyourside,2015,1,1,0,0,
1073281419160502272,the electric cars of the future could be recharged in minutes,2018,1,1,0,0,
914887008413138946,gm will release at least allelectric cars by,2017,1,1,0,0,
1047756550083887104,🕘 liveyourcall with have we fallen out of love with cars 🚗🤔 📞 📱 📢 join the conversation using liveyourcall,2018,1,1,0,0,
758623581299286016,hydrogen picture tube since cars the benefits gmd,2016,1,1,0,0,
743076062674849792,train whydrogen rich ho rapid hydration info sales no plastic waste,2016,1,1,0,0,
1189669883962724352,desalination is increasingly seen as one answer to worsening water scarcity issues worldwide check out my blog on the role hero® and hydrogen can play in helping communities get the water they need to thrive with minimal cost to the environment,2019,1,0,1,1,
1365202444041523206,feb aiaa lalv sustainable aviation miniconference also an engineers week event please join us current topics in sustainable aviation including biofuelssustainable aviation fuels hydrogen and electric aircraft,2021,1,1,0,1,
1131541032510865409,comparisons with the hindenburg disaster are unhelpful and unfair but how can we explore hydrogen use in modern aviation and make safety a priority,2019,1,0,1,1,
943609524740677633,boost your ev battery life in winter using these tips from nreltransport,2017,1,1,0,0,
834898781648773120,record ev sales teslas production goals could be a death blow to the oil industry via video,2017,0,1,0,0,
1560049711649890305,crappy chargers and skyhigh prices are huge roadblocks to ev adoption by,2022,0,1,0,0,
1583561627009536001,introducing the first ever gmc sierra ev denali the only ev worthy of the name denali,2022,0,1,0,0,
1561698447006216192,year old reports available on internet indicate that not a single indian company figures in the top ev companies by market capitalisation industry has consolidated and any new entrants may not see significant returns time to focus on hydrogen,2022,1,0,1,1,
1519951850879033344,to build on our work through the ifca programme we worked with to develop a model to advise on the optimal location and size of ev charge points in the city of bengaluru 🔌🚗 learn more👉,2022,1,1,0,0,
1180042596367896576,“we are living through a climate emergency – and it is our duty to leave a cleaner planet for future generations but we need to work together to achieve this that’s why i’m calling for an active travel revolution in our city region,2019,1,1,0,0,
461070078101172224,fan of electric racing meet hydrogen racing team and the electric motocross emx at during cleanweek,2014,1,1,0,1,
994949656777056256,does anyone use any of those uv teeth whiteners i need to clean up because i drink too much coffeewine and i don’t see myself giving that up anytime soon due to our political climate,2018,1,1,0,0,
1196665854756315138,co split and changed with hydrogen makes h and carbon which is why ibm took my idea because they can profit off carbon because everything on this planet is carbon based and then we get water too and ibm wanted that i dont care clean the damn atmosphere already,2019,1,1,0,0,
1175851609026416640,how do i clean tarnish off of sterling silver,2019,1,1,0,0,
357773112818941953,cleantech pr guest blog from time to herald hydrogen,2013,1,1,0,0,
1088184093832028161,orkney has over wind turbines producing of electricity making it a poster child for sustainability,2019,1,1,0,0,
1207744500136697856,german offshore wind output surges in increasing its electricity consumption that is renewable from to,2019,1,1,0,0,
1574258957304025089,meanwhile the destruction of habitat rages on in fnq for kaban wind farmthe proposed chalumbin wind farm is close by approx km away we live in a world where everyone seeks to stop climate change but will willingly sacrifices wild places wildlife for electricity,2022,1,1,0,0,
1064979529939079168,“a kilo of food per day from nothing but electricity water and air” this bold vision belongs to which plans to use the powderlike product in foods like bread and pasta,2018,1,1,0,0,
1510180150935232522,this is literally what i think every morning when i look at my kids today i’m going to make electricity suppliers’ shareholders richer at the expense of ordinary people i’m obsessed with it,2022,1,1,0,0,
779459527511080960,researchers discover a cell in spinach that uses sunlight to produce electricity and hydrogen,2016,1,0,1,1,
779036300074627072,a cell in spinach that uses sunlight to produce electricity and hydrogen,2016,1,0,1,1,
1303390919144747008,at our german site jülich we are looking for a mitarbeiter logistik lager mwd please send us your cv if you feel your skillset matches this role careers decarbonisation h nproxx renewables hydrogen,2020,0,1,1,1,
1354419581025193985,how to deeply decarbonize industry electrosynthesis might be an important option including water electrolysis but also beyond read the latest comment by or very own tobi schmidt on how policy can help spur this option openaccess in,2021,1,0,0,0,
1598218499843063810,airbus boss warns of delay in decarbonising airline industry,2022,1,0,1,1,
1200172780114849792,🔬 the institute for advanced materials inam of the universitat jaume i uji is designing a electrochemical reactor to make possible the conversion of carbon dioxide co from the atmosphere into chemical products such as hydrogen,2019,1,1,0,1,
1035123263381426176,california hydrogen tank gas leak flashover fire prompts evacuations in el cajon hazmat,2018,0,0,1,1,
722799511186317312,success of hydrogen highlights the changing expectations of uni students when looking for accommodation read more,2016,1,1,0,0,
1174737767114448897,but many also say that volkswagens sheer size and extremely diverse portfolio mean that if anyone can do it it might be the german giant betting the company good luck vw tsla tslaq,2019,1,1,0,0,
1189203019323367427,kenworth rolls out overtheair updates via,2019,1,0,0,0,
1193939481939722240,where did our sun gets its hydrogen ⛽ fuel baby stars,2019,1,1,0,0,
1188667277526425601,twodimensional material has potential as hydrogen store,2019,1,1,0,0,
1179750771065270273,ditching platinum for the ocean could make hydrogen cheap via,2019,1,0,1,1,
1194429265200254976,this sounds super rad super ecofriendly and bet it is fast always runs on time rarely breaks down germans know engineering,2019,1,1,0,1,
825123776643874817,bbc news claim made for hydrogen wonder material,2017,1,1,0,1,
888171362497380352,what does techcommercialization look like is an example theyve turned tech from into success,2017,1,0,0,0,
669156560212467712,catalytic performance of ceriasupported cobalt catalyst for corich hydrogen production from dry reforming of ch,2015,1,1,0,0,
592058076250910721,i just uploaded highly stable nano ce–la catalyst for hydrogen production from bioethanol to,2015,1,0,1,1,
1391756182721908736,lowcarbon hydrogen production center of rusatom overseas and air liquide project,2021,1,0,1,1,
455370677227249664,cafeo sensitized hierarchical tio photo composite for hydrogen production under solar light irradiation pu,2014,1,1,0,1,
846591201578958848,ecologyhydrogen production this is how green algae assemble their enzymes,2017,1,0,0,0,
872525832052289536,catalytic hydrogen production,2017,1,1,0,1,
1370256028227489793,preparation condition optimization and stability of cubic phase cds in photocatalytic hydrogen production,2021,1,1,0,1,
327097561695522816,recipe for lowcost biomassderived catalyst for hydrogen production,2013,1,1,0,1,
327076903234174977,recipe for lowcost biomassderived catalyst for hydrogen production researchers have described details of a,2013,1,1,0,1,
1433682995966267404,‘hycean’ a portmanteau of hydrogen and ocean that’s not so far far away gpwx globalwarming climatechange,2021,1,1,0,0,
930497062076141570,listen to some of our taskforce members explain what green finance is and how the uk can become a global leader cop cleangrowth,2017,1,1,0,1,
844134705255464961,market research report store market research report on global hydrogen con,2017,1,1,0,1,
517604398776975360,seiyaconsulting cheap hybrid outperforms rare metal as fuelcell catalyst,2014,1,1,0,0,
824843261525192707,دوسری طرف hydrogen turned into metal in stunning act of alchemy that could revolutionise technology and spaceflight,2017,1,1,0,1,
824695205215567872,new claim staked for metallic hydrogen,2017,1,1,0,1,
824991311975608320,excited about metallic hydrogen potential,2017,1,1,0,1,
825150429109555200,theres reason to be skeptical about metallic hydrogen,2017,1,1,0,1,
920655679605506049,what in the world is metallic hydrogen what does it even mean more with at daysofastro,2017,1,1,0,1,
824952172144111616,metallic hydrogen created in diamond vise,2017,1,1,0,1,
825677156617330688,scientists claim to have created the rarest material on the planet metallic hydrogen via,2017,1,1,0,1,
828559161952710656,potential discoveries include ancestor saccorhytys coronarius metallic hydrogen learn more in this scishow video,2017,1,1,0,1,
1021797430159921152,more mysteries of metallic hydrogen technology whatsnew,2018,1,1,0,1,
1022904627572998144,researchers unravel more mysteries of metallic hydrogen,2018,1,1,0,1,
685080497391824897,big squeeze hints at metallic hydrogen british researchers use diamonds to compress hydrogen very close to th,2016,1,1,0,1,
685162946914209792,new study hints that we’re closing in on metallic hydrogen,2016,1,1,0,1,
685646964034158593,scientists inch closer to state of metallic hydrogen,2016,1,1,0,1,
777894672387551232,physicists are close to producing metallic hydrogen chemicalelements,2016,1,0,0,0,
825169278336917509,metallic hydrogen discovery by harvard scientists raises superconductor hope,2017,1,1,0,1,
466575503663824896,tweet retraction we work fast tm metallic hydrogen paper contested and results not replicated independently original tweet stands,2014,1,0,0,0,
1196074204094967809,hey buddy metallic hydrogen is easy while…,2019,1,0,0,0,
836231455608983552,deccan chronicle worlds first metallic hydrogen sample disappears deccan chronicle the metallic hydrogen was being…,2017,1,1,0,0,
685085889614053376,big squeeze hints at metallic hydrogen,2016,1,1,0,1,
804583320008855552,hydrogen axion star metallic hydrogen bound to a qcd axion bec physicspapers,2016,1,0,0,0,
836145711116922880,worlds only sample of holy grail metallic hydrogen lost in laboratory mishap superpressure metallica,2017,1,1,0,1,
826538153225904130,if i make metal i want it to be like that new hydrogen metal they made a few days ago,2017,1,1,0,1,
367949694619496448,is frozen liquid metal hydrogen just metal hydrogen,2013,1,1,0,1,
362395060060422147,how does hydrogen metallize,2013,1,1,0,1,
1032625620734210048,hydrogen could now be converted into liquid drops of metal using pulses from giant lasers improving the understanding of giant gas planets and settling debates over the physics of the lightest element in the universe read at pragyan,2018,1,0,0,0,
452552040569270272,solar hydrogen and aluminum a guide to the latest in advanced vehicle technology newsad link,2014,1,1,0,1,
1309180694292168704,what should investors think about in light of california’s electric vehicle mandate sharing my thoughts on “making money with charles payne” on with today at pm et,2020,0,1,1,0,
971728510871113729,if government grants were considerably reduced would this affect your decision to use electric vehicles,2018,0,1,0,0,
965637157854613505,how to decide if a hybrid or electric vehicle is right for you roadshow,2018,1,1,0,1,
1571521041154834433,the department of transportation just announced plans to build electric vehicle charging stations across miles of highways that’s a buttigieg win,2022,0,1,0,0,
965663162442776577,how to decide if a hybrid or electric vehicle is right for you driveelectrichawaii driveelectric electriccars electricvehicles 🚙🔌🔋,2018,0,1,0,1,
1197318455604604928,ev lithium cobalt ajm avz mll pls gxy ltr pll a min lac alb sqm agy asn lpi talisons greenbushes amg mibra vald’or electric vehicle sales are about to explode ark invest ceo,2019,1,1,0,0,
765205195550752768,year study modern ev could replace of current vehicle use today,2016,1,1,0,0,
1352290260718407680,with the cancelling of keystonexl looking at another variable— the mad rush by vehicle makers away from ice internal combustion engines— the question what’s next for alberta’s economy 🤔 thoughts yeg ableg yyc,2021,1,1,0,0,
828108149542395908,bladder tank air matress pure hydrogen uncompressed running a gas generator not hho,2017,1,1,0,0,
938532181755838464,ergosup produces hydrogen at bar at the electrolyser outlet,2017,1,1,0,1,
938428858411507714,hydrogen gas from enzyme production physorg,2017,1,1,0,0,
900826080596164613,bayotech just made a major breakthrough with its hydrogen development credits nms catalyst fund for its success,2017,1,1,0,1,
910518111559749633,info on program w saving the planetwith really nice cars,2017,1,1,0,1,
920398387849052162,this site has an upgraded ports plan even thought it my say it was ready before then ports hydrogen zev,2017,1,1,0,0,
705060837157896194,rt cnetnews rt cnet pininfarina converts hydrogen into speed genevamotorshow,2016,1,1,0,0,
705883074911928320,bad news lowcarbon air travel isn’t very likely,2016,1,0,0,0,
1580969335798919172,the keynote speech at the oct world hydrogen conference a bracing shower of cold water on all the hydrogen hype this article is worth a read hydrogen bluehydrogen,2022,1,0,1,1,
819920616077852672,from science alert “physicists have created a new form of hydrogen”,2017,1,1,0,1,
1234841087199633408,hydrogen revisited chinwag podcast energy central,2020,1,0,1,1,
652348066230628352,hydrogen energy,2015,1,0,1,1,
844836557194313731,discoveries radiation of hydrogen energy,2017,1,1,0,1,
313871042038870016,i liked a video from epoch hho hydrogen energy showroom introduction part,2013,1,1,0,1,
1329703884466642945,fascinating how many people representing the fossil fuel industry suddenly discover their concern about energy poverty i wonder why i never came across them before in my work on energy efficiency,2020,1,1,0,0,
1471239153375322114,the european union proposes new measures to ensure the use of lowcarbon energy in the bloc’s shift away from fossil fuels via,2021,1,1,0,0,
1343950338081042433,the top energy stories of december robert rapier senior contributor,2020,1,0,0,0,
457590664289480704,find out if alternative energy sources can work for you,2014,1,1,0,0,
1113731706840862720,it is going too be awesome when the daintree becomes a leader in renewable energy some say it will lead to over development but we have a strict town plan and the microgrid will be sized to the plan,2019,1,1,0,1,
1511000640142684163,new proposal to include renewable energy sources in accounting for national wealth is gaining traction but how do we measure their value with changing technologies market conditions and policies listen to tellmehow 🎙️ ⏯️ ⏯️ ⏯️,2022,1,1,0,0,
458979767245471746,with existing energy sources dwindling we need alternatives,2014,1,1,0,0,
1182532347348078593,“in total it can store kg of hydrogen which is the equivalent of two megawatts of energy this is the annual consumption of an average household – so a lot of energy ” energy observer crewmember amélie conty told the independent,2019,1,1,0,1,
687670071062343680,transport is the least energy secure sector relying almost entirely on imported oilbased products energysecurity,2016,1,1,0,0,
1137709425874145281,there is no looming climate catastrophe it’s an invention of climatologists to continue receiving huge government subsidies the sun produces energy through core thermonuclear fusion reactions converting hydrogen into helium,2019,1,0,0,0,
1181697630310502401,the energy observer is a boat that makes its fuel out of seawater via travel climatechange,2019,1,1,0,1,
1025684051733225472,nickelhydrogen cold fusion by intermediate rydberg state of hydrogen selection of the isotopes for energy optimization and radioactive waste minimization lenr coldfusion fusion nuclear actonclimate climatechange energy,2018,1,0,0,0,
989972161828982784,cnn reports a puerto rico resident spent weeks building a solar system using in parts cheaper than the a month to run a gas generator waiting up to hours in gas lines sustainabilityhydrogenfuelcellsenergyindependenceclimatechange,2018,1,1,0,0,
1196786211282718722,ai solar concentrator reaches c enough to make cement glas from sunshine secretive energy startup backed by bill gates achieves solar breakthrough,2019,1,1,0,1,
1407704087215460358,producing methane for energy in underground repositories using solar energy,2021,1,0,0,0,
1563536479171002368,and why are we getting massive increases in wind solar hydrogen biomass and nuclear parts of our bill we’ve paid subsidies to build this and it makes up of our energy also ns gas is ours and comes to us why is this charged at stupid rates,2022,1,1,0,1,
1174229464416493569,how will the uks journey to zero carbon affect you some thoughts from me with links to bbcs energy briefing a detailed look at the challenges and choices on the road to zero carbon,2019,1,1,0,1,
1135490072680157185,shanghai electric to build mw in australia the chinese electrical equipment giant will build the first project of simec energy australia’s landmark billion gw dispatchable renewable energy program in the state of south australia solar pv,2019,1,1,0,0,
368342683578036224,sustainable energy breakthrough hydrogen fuel from sunlight via,2013,1,1,0,1,
1087032702010884098,how orkney leads the way for sustainable energy,2019,1,1,0,1,
1271772472526995456,and we are now stop the bullshxt please spain eu team member can create green fotovoltaic energy for the whole eu and have full employement please stop the lies,2020,1,1,0,0,
1478426508360392710,nasa throws a dart at an asteroid and green hydrogen for ammonia energy,2022,1,0,1,1,
1475126329502846977,hydrogen that bubbles up naturally 💨💦 i dont know about you but this sounds great to me 🌎 ressources energy planet carbon oil green ➡️,2021,1,1,0,1,
1529128193545756672,from stockheadcomau pure hydrogen grabs a hefty slice of asx hopeful botala energy published ph africa hydrogen drilling,2022,1,1,0,0,
883296140699078656,we can afford the cleanenergy transition g,2017,1,1,0,0,
1451551961225076746,what cleanenergy technology are you most excited about,2021,1,1,0,0,
1514936620411092995,drove my new from adelaide to melbourne today driver fatigue zero total cost on supercharging only range anxiety was whether there were more teslas than chargers at horsham love this “car” sick ❤️ cleanenergy,2022,1,1,0,0,
353926780068966402,champion nanorust for producing solar hydrogen nanostructures forming the iron oxide particles hyfri cleanenergy,2013,1,1,0,1,
997306537285701637,a new type of battery is cheaper and longer lasting creating new possibilities for use with renewable energy generation energycitizenship energyartlv renewableenvoy vegas solar climateeconomy renewableenergy cpacenv cleanfuturenv vg renewnv,2018,1,1,0,1,
1344591629382864897,soon new nanomaterial will help obtain clean fuel source cleanenergy,2020,1,1,0,1,
499384527568269312,stinky landfills might soon generate clean energy see more,2014,1,1,0,1,
1184371230226280448,dr mamdud hossain reader in thermofluids at the school of engineering robert gordon university aberdeen scotland made the keynote presentation during a national conference on clean energy clean water at vit chennai in the first week of october,2019,1,1,0,0,
409951420775821313,hydrogen recipe lifts hopes of cheap and clean energy,2013,1,1,0,1,
1602482241183023107,this is huge for the first time in history us scientists have successfully produced a nuclear fusion reaction resulting in a net energy gain this is a massive step in a decadeslong quest to unleash an infinite source of clean energy that could end dependence on fossil fuels,2022,1,1,0,0,
930263631547326464,takeshi uchiyamada of spells out need for hydrogen to be a piece of the clean energy mix also til theres a hydrogen council do you think the other atoms are jealous,2017,1,0,1,1,
352459441687371777,alternative energy a cooler way to clean hydrogen,2013,1,1,0,1,
